text,label,category,tr_xlm_roberta,vader,org_lang,twitter_xlm_roberta_base_sentiment_multilingual,xlm_roberta_base_sentiment_multilingual,memo_bert_sa,da_sentiment_base
"it waved like a layer,",5.0,hymns,-0.447773814201355,0.3612,dk,0.0,-0.42665764689445496,0.0,0.9730088710784912
With power from the high and low house,5.0,hymns,0.5483176708221436,0.0,dk,0.0,0.0,0.9356186389923096,0.0
Meeted on Pentecost!,5.0,hymns,0.7515379786491394,0.0,dk,0.0,0.0,0.0,0.9757851362228394
"There were seen tongues like fire and glow,",5.5,hymns,0.0,0.0258,dk,0.0,0.0,0.0,0.0
"The friends of God they flew in the mouth,",5.0,hymns,0.0,0.4767,dk,0.0,0.4148731827735901,0.0,0.0
"On all people's tongues the Word of God reverberated,",6.0,hymns,0.0,0.0,dk,0.0,0.6290314793586731,0.0,0.7066202163696289
"Diverse, but similar in the ground.",6.0,hymns,0.0,0.0,dk,0.0,0.0,0.0,0.0
"Then lit on earth a light from God,",6.5,hymns,0.5916177034378052,0.2732,dk,0.9120075702667236,0.7369623184204102,0.0,0.0
"there gardens like the sun beamed,",6.0,hymns,0.0,0.3612,dk,0.7953913807868958,0.587985098361969,0.0,0.5176750421524048
How living voices God's Christmas Buddy,6.0,hymns,0.0,0.0,dk,0.7273073196411133,0.690514862537384,0.0,0.0
preached in the mother tongue.,5.5,hymns,-0.4866514205932617,0.0,dk,0.0,0.0,0.0,0.0
"And do we have until now on the big word,",5.5,hymns,0.0,0.0,dk,0.0,0.0,0.0,0.0
"As the kids small only stemmed,",4.5,hymns,0.0,-0.2263,dk,0.0,0.0,0.0,0.0
"of the fire of heaven that came to earth,",5.5,hymns,0.0,-0.34,dk,0.7567548155784607,0.8003588914871216,0.0,0.0
"However, we have a spark anameted.",5.0,hymns,0.0,0.2263,dk,0.0,-0.6291943788528442,0.0,0.7899757623672485
"The spark that it is smearing with us yet,",5.0,hymns,0.0,0.2263,dk,0.4898192882537842,-0.725919246673584,0.0,0.0
"Flutters and in the hour of God,",5.0,hymns,0.0,0.0,dk,0.0,0.7661064267158508,0.0,0.0
"So happily it runs us into the house,",5.5,hymns,0.7452998161315918,0.5849,dk,0.9296698570251465,0.9234670996665955,0.0,0.0
that Himmerig's bells kime.,6.0,hymns,0.619123637676239,0.0,dk,0.45824792981147766,-0.45905059576034546,0.0,0.0
"To the Father,",5.0,hymns,0.4666026830673218,0.0,dk,0.6135953664779663,0.7365013957023621,0.0,0.0
"O soul, they do not forget!",5.0,hymns,0.4755502641201019,0.2401,dk,0.0,0.7209094762802124,0.0,0.9801903367042542
Guess Jesus,5.0,hymns,0.0,0.0,dk,0.0,0.0,0.0,0.0
through the suffering;,3.5,hymns,-0.5179398655891418,-0.4767,dk,-0.5276303291320801,-0.6991706490516663,0.0,0.0
"Think, it was so heavy a way!",3.5,hymns,-0.8044431805610657,0.0,dk,0.0,-0.8539619445800781,-0.9999881982803345,0.9285030364990234
"When you, like him, wander must",5.0,hymns,0.4785900712013244,0.3612,dk,0.0,-0.45540809631347656,0.0,0.9948955178260803
"the valley of death,",3.5,hymns,-0.6521396636962891,-0.5994,dk,-0.7564393281936646,-0.779992938041687,0.0,0.0
"you comfort and assistance get,",6.5,hymns,0.6374632120132446,0.6369,dk,0.0,0.8135425448417664,0.0,0.9092866778373718
And not alone goes;,6.0,hymns,0.0,0.1877,dk,0.0,-0.6670912504196167,0.0,0.0
"Look, your Savior is coming along,",7.0,hymns,0.5277766585350037,0.0,dk,0.9655914902687073,0.5798118710517883,0.0,0.0
"Come in Hu, he has been bering",5.0,hymns,0.0,0.2263,dk,0.0,-0.6997815370559692,0.0,0.8186942338943481
You with the Father his place!,5.5,hymns,0.0,0.0,dk,0.497498095035553,0.7660682201385498,0.0,0.9813051819801331
"at no moment,",5.0,hymns,0.0,0.0,dk,0.0,0.0,0.0,0.0
Then the light goes out.,4.0,hymns,-0.528612494468689,0.0,dk,0.6812490224838257,0.0,0.0,0.0
O You who went,5.0,hymns,0.4785154163837433,0.0,dk,0.0,0.0,0.0,0.8070049285888672
and the sky opened got,6.0,hymns,0.6122601628303528,0.5106,dk,0.5953891277313232,0.0,0.9999814033508301,0.0
and reconciled me with God:,5.5,hymns,0.0,0.2732,dk,0.7889583110809326,0.7891295552253723,0.0,0.9598605036735535
"When I have to go along that path,",5.0,hymns,0.0,0.0,dk,0.0,0.48508232831954956,0.0,0.0
Where you do not,5.0,hymns,0.0,0.0,dk,0.0,0.0,0.0,0.0
"back comes more,",5.0,hymns,0.0,0.0,dk,0.0,0.0,0.9983658194541931,0.0
"O, Sønderbryd my clay,",4.5,hymns,-0.6131132245063782,0.0,dk,0.0,-0.37443187832832336,0.0,0.0
"Solve me the hard bond of death,",4.0,hymns,-0.8356603980064392,-0.6486,dk,0.0,0.5286198854446411,-0.9999465942382812,0.0
"Send me your the good spirit,",6.0,hymns,0.583715558052063,0.5574,dk,0.9191452860832214,0.8247812986373901,0.9999804496765137,0.0
Take my soul in your hand!,5.5,hymns,0.0,0.5411,dk,-0.4743649959564209,0.7223437428474426,0.9997445940971375,0.9971983432769775
"I am looking forward to,",7.0,hymns,0.872595489025116,0.4404,dk,0.9822263717651367,0.9431473612785339,0.0,0.0
"O Jesus, by my baptism,",5.5,hymns,0.0,0.0,dk,0.4899352788925171,0.0,0.0,0.0
"And thanks you, of the heart deeply",7.5,hymns,0.7466517090797424,0.3612,dk,0.8988586068153381,0.8883419036865234,0.7347102761268616,0.9786826372146606
For the hope of the great life,7.0,hymns,0.8626610040664673,0.7906,dk,0.9599530100822449,0.9033538699150085,0.9999828338623047,0.0
"and that union on the grounds of bliss,",6.5,hymns,0.0,0.0,dk,0.5577927827835083,0.8030809164047241,0.0,0.0
As you with me have done,5.0,hymns,0.0,0.0,dk,0.0,0.5287067294120789,0.0,0.9334008693695068
In the Gate of Heaven!,6.5,hymns,0.7993011474609375,0.5562,dk,0.9314483404159546,0.802291989326477,0.0,0.0
Like my shield I for me berry,5.5,hymns,0.0,0.0,dk,0.0,0.43679702281951904,0.0,0.9941583871841431
"commitment yours, o jesus dear,",5.5,hymns,0.6124356985092163,0.5994,dk,0.0,0.6479417681694031,0.8735183477401733,0.0
That i your co -heir is.,5.5,hymns,0.0,0.0,dk,0.0,0.0,0.0,0.0
"A Holy Life, a Blessed Death",6.5,hymns,0.896920919418335,0.0,dk,0.9245449304580688,0.8406681418418884,-0.7016477584838867,0.9852691292762756
each other loving meeting,7.0,hymns,0.7394126057624817,0.6369,dk,0.8530625700950623,0.9190579056739807,0.0,0.0
As the bird case softly sweet,7.5,hymns,0.5603996515274048,0.8126,dk,0.7512266039848328,0.7906520366668701,0.0,0.0
A delicious evening red:,7.0,hymns,0.7578736543655396,0.5106,dk,0.9779595136642456,0.9342909455299377,0.0,0.0
"The two may not be separated,",5.5,hymns,-0.528938889503479,0.0,dk,0.0,0.0,0.0,0.0
"One makes the other happy,",6.0,hymns,0.7397937774658203,0.5719,dk,0.9515693187713623,0.7842841148376465,0.9999818801879883,0.0
And very delicious embrace.,7.0,hymns,0.7820093631744385,0.5256,dk,0.957904577255249,0.9411864876747131,0.9999251365661621,0.9848071336746216
Having struggled the good struggle,6.0,hymns,0.7722864151000977,-0.25,dk,0.0,0.738265872001648,0.9999725818634033,0.0
and horizontal unabashed,6.0,hymns,-0.3891243040561676,0.0,dk,0.0,0.0,0.0,0.0
"On the path of faith to last time,",5.0,hymns,0.0,0.4215,dk,0.538911759853363,0.8421373963356018,0.0,0.0
Where is it sweet in death!,6.0,hymns,0.8601229786872864,-0.2942,dk,-0.9344974756240845,0.8595650792121887,0.9999769926071167,0.9899438619613647
"Well, the one his Lord's faith has earned,",5.5,hymns,0.8511459827423096,0.7717,dk,0.9378350377082825,0.8491135239601135,-0.998474657535553,0.0
"His deed done, his race completed",6.0,hymns,0.7196986079216003,0.0,dk,0.8371792435646057,0.6687620878219604,0.0,0.0
And away in peace can danger!,6.5,hymns,0.6933917999267578,0.5848,dk,-0.6949077248573303,-0.8550188541412354,0.0,0.992363691329956
"O Simeon, you the man of the Lord,",5.0,hymns,0.8307169675827026,0.0,dk,0.9424827098846436,0.7916263341903687,0.0,0.0
And Thousands of Happiness!,7.0,hymns,0.9216672778129578,0.5983,dk,0.9678415656089783,0.8965803384780884,0.0,0.0
You prD have your time and stand,6.0,hymns,0.6398793458938599,0.2023,dk,0.0,0.0,0.0,0.0
with the jewelry of holiness;,7.5,hymns,0.4983043670654297,0.0,dk,0.0,0.6929552555084229,0.0,0.0
You let a heaven walk see,6.5,hymns,0.0,0.0,dk,0.0,0.7152162194252014,0.0,0.9685590863227844
"to the last snow of old age,",4.5,hymns,0.0,0.0,dk,0.0,-0.4629952907562256,0.0,0.0
And served God on earth.,5.0,hymns,0.5618274211883545,0.2732,dk,0.776046872138977,0.8528982400894165,0.0,0.9845387935638428
"All the Savior of the World was your darling,",6.5,hymns,0.652065634727478,0.296,dk,0.662693977355957,0.7951849699020386,0.9250444173812866,0.0
You used your powers,5.0,hymns,0.3873891830444336,0.4939,dk,0.41771358251571655,0.0,0.0,0.0
"To serve the Lord Day and Night,",5.0,hymns,0.6247295141220093,0.0,dk,0.7536686658859253,0.8531683683395386,0.0,0.0
You only strived for it:,5.0,hymns,0.0,0.0,dk,0.0,-0.4682181775569916,0.0,0.0
"You passed the desire of the world,",4.5,hymns,0.4871430397033691,0.4404,dk,0.0,0.7776082754135132,0.0,0.0
and reached on the cramped path,5.0,hymns,0.0,0.1027,dk,0.0,-0.7188791632652283,0.0,0.0
A sweet and blissful end.,6.5,hymns,0.9346743822097778,0.7845,dk,0.9847971200942993,0.941521167755127,0.9999724626541138,0.9961860775947571
What under then that the dwelling of the grave,5.5,hymns,-0.38177090883255,-0.3818,dk,0.0,-0.8457716107368469,0.0,0.0
you not horrified could?,5.5,hymns,-0.85517418384552,0.2584,dk,-0.47970879077911377,-0.7162444591522217,0.0,-0.47869986295700073
You went to the gate of death so fro,6.5,hymns,0.6320220828056335,0.0236,dk,-0.8637598156929016,-0.8874977827072144,0.0,0.0
"As Bird in Frydens Lunde,",7.0,hymns,0.5569234490394592,0.743,dk,0.0,0.0,0.0,0.0
"you took your Jesus sweet in embrace,",7.5,hymns,0.7368314266204834,0.4767,dk,0.8884317278862,0.8171074986457825,0.0,0.9467230439186096
Then did you travel in the name of the Lord,5.5,hymns,0.6083951592445374,0.0,dk,0.5490092635154724,0.0,0.0,0.0
To God in Heaven.,6.5,hymns,0.614424467086792,0.6597,dk,0.6699684262275696,0.8004294037818909,0.0,0.7944037318229675
"O, Jesus is still to get,",5.5,hymns,0.0,0.0,dk,0.0,0.5372482538223267,-0.8038326501846313,0.0
But he will be embraced,5.0,hymns,0.7505944967269897,0.0,dk,0.9225341081619263,0.8258093595504761,0.0,0.0
"Are we not estimated to do so,",5.0,hymns,-0.7892786860466003,0.0,dk,0.0,-0.5639251470565796,0.0,0.9453089237213135
Then it must be deeply regretted;,4.5,hymns,-0.8608143329620361,-0.4391,dk,-0.9673364162445068,-0.9048892855644226,0.0,0.7694191336631775
"For the soul finds no tranquility,",3.5,hymns,0.0,-0.296,dk,-0.6710032224655151,-0.8725715279579163,-0.9847646355628967,0.0
For that in the true belief,5.5,hymns,0.5550243258476257,0.6808,dk,0.0,0.0,-0.999910831451416,0.0
His savior sees and embraces!,7.0,hymns,0.7622761130332947,0.0,dk,0.9455661177635193,0.5615492463111877,0.0,0.0
Like the spring sun morning red,7.0,hymns,0.4434732496738434,0.3612,dk,0.6788730621337891,0.7153011560440063,0.0,0.9171987175941467
Stood Jesus up from the lap of the earth,5.5,hymns,0.0,0.0,dk,0.0,0.0,0.0,0.0
With life and light as well!,7.5,hymns,0.8140502572059631,0.0,dk,0.7968430519104004,0.9051166772842407,0.523768424987793,0.9879557490348816
"Therefore, as long as the world stands,",5.0,hymns,0.0,0.0,dk,0.0,0.48505011200904846,0.0,0.0
Now after winter comes the spring,5.5,hymns,0.0,0.0,dk,0.5673148036003113,0.0,0.0,0.0
Life -affected in the kingdom of God!,6.5,hymns,0.9409129619598388,0.636,dk,0.9060260653495789,-0.8589855432510376,0.0,0.9898359179496765
As Bird Choir in Mark and Lund,6.0,hymns,0.0,0.3612,dk,0.0,0.0,0.0,0.0
Loving Spring in Allen time,6.5,hymns,0.801795482635498,0.5423,dk,0.9793238639831543,0.9392247796058655,0.0,0.0
"With their tones sweet,",6.5,hymns,0.6093433499336243,0.4588,dk,0.8633607625961304,0.8761864304542542,0.0,0.8124505281448364
So all tongues trindt about land,5.0,hymns,0.0,0.0,dk,0.0,-0.6933947801589966,0.0,0.6244407892227173
Loved the superior of the death,6.5,hymns,0.5831953883171082,-0.0772,dk,0.827691912651062,0.8658300042152405,0.8595438599586487,0.0
In Easter morning red!,6.5,hymns,0.5440117716789246,0.0,dk,0.9265913963317871,0.6617761254310608,0.0,0.0
"As flowers everyone stands in flor,",6.5,hymns,0.5010461807250977,0.3612,dk,0.0,0.0,0.0,0.0
"As the forest is green, the grain grows,",6.5,hymns,0.610021710395813,0.0,dk,0.8539859056472778,0.8200466632843018,0.0,0.0
"At the forces of spring mild,",6.0,hymns,0.6611850261688232,0.4404,dk,0.6951307654380798,0.6400977969169617,0.0,0.0
Then everything blooms in Jesus' name.,6.5,hymns,0.7238228917121887,0.0,dk,0.9219365119934082,0.6051560640335083,0.0,0.0
"And bears fruit to folk games,",7.0,hymns,0.7433338761329651,0.4588,dk,0.7349522709846497,0.8603373765945435,0.0,0.0
"Like early, so late!",5.5,hymns,0.0,0.0,dk,-0.9431238770484924,-0.45607790350914,0.9684300422668457,0.9809530377388
"God Holy Spirit, Our Commerck,",6.0,hymns,0.629361093044281,0.5574,dk,0.0,0.7246849536895752,0.0,0.9985144734382629
"Rightly you must complain,",5.0,hymns,-0.6272363662719727,-0.3612,dk,-0.9190018773078918,-0.9057329893112183,0.0,0.961098849773407
You stayed with us in the land of dust,5.0,hymns,0.0,0.0,dk,0.0,0.0,0.0,0.0
"Centuries like days,",5.0,hymns,0.0,0.3612,dk,0.0,0.0,0.0,0.0
"You stayed with us in the name of Jesus,",5.0,hymns,0.7364916801452637,0.0,dk,0.8353840112686157,0.8202276825904846,0.0,0.0
"In his, as you emitted,",5.0,hymns,0.0,0.0,dk,0.0,0.0,0.0,0.0
"Is often, however, in his birth name",5.0,hymns,0.0,0.0,dk,0.0,0.0,0.0,0.0
The great unknown!,5.0,hymns,0.6467151045799255,0.6588,dk,0.5310961008071899,0.9009431600570679,0.9999762773513794,0.7912853956222534
"You are the voice of God on the path of life,",5.5,hymns,0.7783953547477722,0.0,dk,0.9493656158447266,0.8467382788658142,0.0,0.5174441337585449
"Al Heaven's speech ability,",5.5,hymns,0.0,0.0,dk,0.9442126750946045,0.801479697227478,0.0,0.0
So without you our Jesus not,5.0,hymns,-0.6192429661750793,0.0,dk,-0.8106620907783508,-0.7101799249649048,-0.9998025298118591,0.9007112979888916
Our Lord we can mention!,5.0,hymns,0.7157291769981384,0.0,dk,0.8584426641464233,0.7691364884376526,0.0,0.8466753363609314
"But did it become clear to us yet,",5.5,hymns,0.0,0.5267,dk,0.0,0.0,0.0,0.0
That you can us house wale?,5.5,hymns,0.7210350036621094,0.3612,dk,0.0,0.0,0.0,0.0
"And pray we: the Spirit of God, be you",5.5,hymns,0.6621716022491455,0.6249,dk,0.8007035255432129,0.7931544184684753,0.0,0.9852691292762756
Our tongue and our speech?,5.0,hymns,0.0,0.0,dk,0.0,0.0,0.0,0.0
"Oh no, we hardly think about,",4.5,hymns,0.0,-0.296,dk,0.0,-0.89399653673172,-0.999832272529602,0.996304988861084
"That so it should be,",5.0,hymns,0.0,0.0,dk,0.0,0.0,0.0,0.0
"Should you in Father's place us stand,",5.0,hymns,0.0,0.0,dk,0.0,0.0,0.0,0.9019768834114075
"We seek must your honor,",5.5,hymns,0.5644180774688721,0.4939,dk,0.8408481478691101,0.7959457635879517,0.0,0.9925249814987183
Should Jesus Christ Secret,5.0,hymns,0.0,0.0,dk,0.0,0.0,-0.9991180300712585,0.5570431351661682
"Us guest and enrich,",6.5,hymns,0.6913071274757385,0.0,dk,0.5852628350257874,0.0,0.0,0.0
"We and must believe he is in you,",5.5,hymns,0.0,0.0,dk,0.578161895275116,0.5483846664428711,0.0,0.9839874505996704
And you in him too!,5.0,hymns,0.5724590420722961,0.3382,dk,0.5957761406898499,0.5947579741477966,0.0,0.9919426441192627
We should not shout: Come to us!,5.0,hymns,0.0,0.4303,dk,-0.6261738538742065,-0.8056012392044067,0.0,0.9908617734909058
"As you were in the distance,",5.0,hymns,0.0,0.0,dk,0.0,0.0,0.0,0.0
"But sigh: sin and death in spite of,",5.0,hymns,0.0,0.8502,dk,-0.5992013216018677,-0.9336440563201904,0.0,0.0
"The Spirit of God!Stay with us like,",6.0,hymns,0.8238996267318726,0.6696,dk,0.5886399149894714,0.7679423689842224,0.0,0.997643768787384
For Jesus' sake that you have sent,5.0,hymns,-0.7454518675804138,0.0,dk,-0.5313915610313416,0.7561350464820862,-0.998927891254425,0.0
"To his fatherless,",4.5,hymns,-0.6422482132911682,0.0,dk,-0.5344260931015015,-0.48665526509284973,0.0,0.0
"Will over them, in you acknowledged,",5.0,hymns,0.0,0.0,dk,0.0,0.0,0.0,0.0
His love is troubling!,6.5,hymns,0.5514535903930664,0.6696,dk,-0.9787051677703857,-0.8907825350761414,0.0,0.0
"Yes, stay with us, our comfort man!",6.5,hymns,0.7608710527420044,0.7088,dk,0.9645757079124451,0.8294503688812256,0.0,0.9947295784950256
Our spokesman and companion!,6.5,hymns,0.8350912928581238,0.0,dk,0.9601852893829346,0.7866734862327576,0.0,0.9584588408470154
"Enlive with us each speech sand,",6.5,hymns,0.4516006112098694,0.6597,dk,0.0,0.4560566842556,0.0,0.0
"So god it pleases,",6.5,hymns,0.6252653002738953,0.7322,dk,0.9320282936096191,0.8135021328926086,0.9999747276306152,0.9727954864501953
"For he is not the god of the dead,",5.5,hymns,0.0,-0.7281,dk,0.0,-0.9034063816070557,-0.9999861717224121,0.0
"And live we only meme,",5.0,hymns,0.0,0.0,dk,0.0,-0.6703648567199707,0.889495313167572,0.6944687962532043
Until you go out of God the Father out,5.0,hymns,0.0,0.2732,dk,0.0,0.0,0.0,0.9947181344032288
And wakes us up as stones.,5.0,hymns,-0.4378018379211426,0.3612,dk,-0.6052011847496033,0.44234123826026917,0.0,0.9301478266716003
Each time you hear the words of the Lord,5.0,hymns,0.5815621018409729,0.0,dk,0.7299272418022156,0.8231794834136963,0.0,0.0
"From our death lips,",4.5,hymns,0.0,-0.5994,dk,0.0,-0.5106296539306641,0.0,0.0
"As it was muttered under ground,",4.5,hymns,0.0,0.0,dk,0.0,0.0,0.0,0.0
"Though it to the sky strives,",5.0,hymns,0.0,0.5106,dk,0.0,-0.5598570108413696,0.0,0.0
"Oh, take it up, pronounce it right,",5.0,hymns,0.0,0.0,dk,0.0,0.0,0.0,0.0
"So we can sense,",5.0,hymns,0.0,0.0,dk,0.0,0.0,0.0,0.0
"To us came well from Nazareth,",5.5,hymns,0.6239374876022339,0.4404,dk,0.7138184905052185,0.8559642434120178,0.0,0.0
The good shepherd's voice!,6.0,hymns,0.8906155228614807,0.4926,dk,0.9849473237991333,0.9184789657592773,0.9998053908348083,0.9774651527404785
Each time an honest soul on earth,6.0,hymns,0.0,0.5106,dk,0.0,0.8508127331733704,0.0,0.0
Will his hands fold,5.0,hymns,-0.746600329875946,0.0,dk,-0.9449668526649475,0.0,0.0,0.0
"In the name of Jesus, but the words of prayer",5.0,hymns,0.0,0.0,dk,0.0,0.0,0.0,0.0
Will die on lips cold:,3.5,hymns,-0.8170621395111084,-0.5994,dk,-0.6400469541549683,-0.7762730717658997,0.0,0.0
"Prescribe you over the dust's condition,",5.0,hymns,-0.4144402146339416,0.3612,dk,0.0,0.0,0.0,0.0
Show you on everything can be fined!,5.5,hymns,0.651246190071106,0.0,dk,0.0,0.0,0.98723965883255,0.9948710203170776
"And whispering to us your Father,",5.0,hymns,0.0,0.0,dk,0.6202366948127747,0.6118754744529724,0.0,0.0
So our tongues glow!,5.0,hymns,0.7180272936820984,0.0,dk,0.9793518781661987,-0.9017922878265381,0.9742412567138672,0.9980257749557495
Our meal we decide now,5.0,hymns,0.0,0.0,dk,0.0,0.0,0.0,0.6542812585830688
And fold our hands,5.0,hymns,0.0,0.0,dk,0.0,0.0,0.0,0.0
"To get you our god in house,",5.5,hymns,0.6986720561981201,0.2732,dk,0.0,0.7625172734260559,0.999967098236084,0.993676483631134
As us all good use:,6.0,hymns,0.5284908413887024,0.4404,dk,0.0,0.8964915871620178,0.9999760389328003,0.0
"For calm and peace, for love",7.5,hymns,0.5626904368400574,0.8885,dk,0.788133442401886,0.9023298025131226,0.0,0.7304044365882874
For this meal's eating,5.0,hymns,0.0,0.0,dk,0.0,0.6080272197723389,0.0,0.0
"Of air and water, of forest and land",5.5,hymns,0.0,0.0,dk,0.0,0.0,0.0,0.0
We you by heart praise!,6.5,hymns,0.8689802885055542,0.5983,dk,0.924265444278717,0.8932851552963257,0.0,0.9983425140380859
"O God, where the many are about",5.0,hymns,-0.4867600202560425,0.2732,dk,0.0,-0.832362711429596,0.0,0.9930307269096375
"And after the bread leads,",4.5,hymns,0.0,0.0,dk,0.0,0.0,0.0,0.0
"If poor hand is often empty,",3.5,hymns,-0.895194947719574,-0.5994,dk,-0.7871593832969666,-0.8318528532981873,0.0,0.0
However prayer he is praying:,4.5,hymns,0.6113870143890381,0.34,dk,0.0,0.0,0.0,0.0
How many stand in work and wounds,4.5,hymns,-0.6834254264831543,0.0,dk,0.0,-0.6005720496177673,0.0,0.0
"Missing and suffering ill,",2.5,hymns,-0.899621307849884,-0.8402,dk,-0.9642899632453918,-0.9221053123474121,0.0,0.0
And shouts at a bite to get,4.0,hymns,0.0,-0.4767,dk,0.0,0.0,0.0,0.0
"Of that, we were wasting!",4.0,hymns,-0.690970242023468,-0.4753,dk,-0.9295791983604431,-0.9204209446907043,0.0,0.9161261320114136
"Oh, don't let's our bread basket",5.0,hymns,-0.6512485146522522,0.0,dk,-0.8205509185791016,-0.8965801000595093,0.0,0.9908213019371033
"Behind the lock and close put,",4.5,hymns,0.0,0.0,dk,0.0,0.0,0.0,0.0
Before the one who resorted to us,5.0,hymns,0.0,0.0,dk,-0.6971167325973511,-0.7823682427406311,0.0,0.0
Its piece gets of this,5.5,hymns,0.4724785983562469,0.3595,dk,0.0,0.0,0.0,0.0
"As a total of remains,",5.0,hymns,0.0,0.0,dk,0.0,0.0,0.0,0.0
To comfort in the wet of hunger:,5.5,hymns,-0.6432940363883972,-0.3182,dk,0.5248823761940002,0.7948993444442749,-0.9999184608459473,0.0
"Our Stoves Number Not Decreased Shell,",5.5,hymns,0.0,0.0772,dk,0.0,0.0,0.0,0.0
But grow to grace.,6.0,hymns,0.6401160955429077,0.5719,dk,0.7108814120292664,0.8792087435722351,0.0,0.0
"God signes us in the name of Jesus,",6.0,hymns,0.8033667802810669,0.5994,dk,0.8273182511329651,0.7261157631874084,0.0,0.9960389137268066
Which wants us daily saturated!,6.0,hymns,0.0,0.0,dk,-0.979887843132019,-0.9093112349510193,0.0,0.8247498869895935
We now go to our work and benefit,6.0,hymns,0.0,0.4588,dk,0.6807393431663513,0.8795017004013062,0.99997878074646,0.9757089614868164
In godliness to do:,5.5,hymns,0.0,-0.2732,dk,0.0,0.0,0.0,0.0
"Bless our deed, let the weeping of poverty",6.0,hymns,-0.5708743333816528,-0.5574,dk,0.9294695854187012,0.6705347299575806,0.0,0.0
"Our smallest bite no moisture,",4.5,hymns,-0.6400704979896545,0.0,dk,0.0,-0.5825685858726501,0.0,0.0
"But Guess we must understand that art,",5.5,hymns,0.0,0.0,dk,0.0,0.0,0.0,0.8054835796356201
To comfort those who cry!,6.5,hymns,-0.4112619459629059,-0.2244,dk,0.5259400606155396,0.8141563534736633,0.0,0.9771906137466431
When then in the world nothing broke,3.5,hymns,-0.6489846706390381,-0.296,dk,0.0,0.0,0.0,0.0
"Our tongue more will taste,",4.5,hymns,-0.4568796455860138,-0.296,dk,0.0,0.0,0.0,0.0
Then bother in between life and death,5.0,hymns,0.0,-0.5994,dk,-0.5088649988174438,-0.8612504005432129,0.0,0.0
We The Bread of Life must take!,6.5,hymns,0.5212764143943787,0.0,dk,0.0,-0.4153854250907898,0.0,0.9973698854446411
"Do we give our spirit then in your hand,",5.0,hymns,0.0,0.5994,dk,0.0,0.0,0.0,0.9839889407157898
"O Lord, could give,",5.5,hymns,0.6003508567810059,0.0,dk,0.6936156153678894,0.5738769769668579,0.94134122133255,0.0
Then through death to rest sweet,6.0,hymns,0.0,-0.2911,dk,0.6108869910240173,0.6341176629066467,0.0,0.0
We could led to stay!,5.0,hymns,0.5148488283157349,0.0,dk,0.0,0.6876886487007141,0.0,0.9966664910316467
"Lord God, the joy of my heart,",6.5,hymns,0.817776083946228,0.7096,dk,0.9730004072189331,0.8873162269592285,0.0,0.9962329268455505
"You my soulful and tranquility,",7.5,hymns,0.8274884819984436,0.7184,dk,0.9392262101173401,0.8546637296676636,0.9999805688858032,0.979223906993866
"You my sky all down here,",7.0,hymns,0.582240641117096,0.5106,dk,0.5961437225341797,0.7044999599456787,0.0,0.0
"You my life, my hope, my faith,",7.5,hymns,0.566582977771759,0.6908,dk,0.8956337571144104,0.8255955576896667,0.0,0.9781689643859863
"You my forever hidden darling,",7.5,hymns,0.7812421321868896,0.296,dk,0.9366676211357117,0.8050088882446289,0.4783882200717926,0.5980871915817261
Deep in the grounds of the heart impaired:,6.0,hymns,0.0,0.0,dk,0.0,-0.815378725528717,0.0,0.0
"You happen law and thanks and honor,",6.5,hymns,0.8624312281608582,0.8658,dk,0.5534285306930542,0.7937352061271667,0.0,0.0
As so graciously would be!,5.5,hymns,0.8418071866035461,0.6352,dk,0.9394068121910095,0.8715221285820007,0.9997931122779846,0.9970170259475708
"You much better know me,",6.0,hymns,0.5986602902412415,0.4404,dk,0.5375715494155884,0.5698506236076355,0.0,0.974932074546814
"Than myself from first root,",5.0,hymns,0.0,0.0,dk,0.0,0.0,0.0,0.0
You've had my clay in hands,5.0,hymns,0.0,0.0,dk,0.0,0.7146419286727905,0.0,0.9959465861320496
"Trying every my drop of blood,",4.0,hymns,0.0,-0.2732,dk,0.0,0.0,0.0,0.0
"You mirror all my mind,",5.0,hymns,0.0,0.0,dk,0.6648946404457092,0.6383160948753357,0.0,0.0
"Seeing me completely in the heart in,",5.5,hymns,0.0,0.0,dk,0.0,0.606590986251831,0.0,0.9898833632469177
"No breathing i am dragging,",4.0,hymns,0.0,-0.296,dk,-0.5183818936347961,-0.6619226336479187,0.0,0.0
I am receiving it of you.,5.5,hymns,0.6387448310852051,0.0,dk,0.7802832722663879,0.8583879470825195,0.0,0.0
About you not me all the ensuing,4.5,hymns,-0.6548065543174744,0.0,dk,0.0,-0.6669639945030212,0.0,0.7731478214263916
"After my thoughts with,",5.0,hymns,0.0,0.0,dk,0.0,0.0,0.0,0.0
"About a grief in the bosom stings,",3.0,hymns,-0.8435994386672974,-0.5267,dk,-0.6742306351661682,-0.9010388851165771,0.0,0.0
"As I myself alone know,",4.5,hymns,0.0,-0.25,dk,0.0,0.0,0.0,0.0
If not the sun daily will,4.5,hymns,0.0,0.0,dk,0.0,-0.47160425782203674,0.0,0.0
"Me all happiness shine to,",6.5,hymns,0.7807514667510986,0.5574,dk,0.9277355670928955,0.8710201978683472,0.0,0.9363211393356323
"Therefore I will not complain,",6.0,hymns,0.5152884721755981,0.2755,dk,0.8457068800926208,0.7786003947257996,0.0,0.0
You can just as well.,5.5,hymns,0.6872341632843018,0.2732,dk,0.0,0.5466259121894836,0.0,0.9733448624610901
About even lightning flame teeth,4.5,hymns,-0.5169808268547058,0.0,dk,-0.706859827041626,-0.5139983892440796,0.0,0.0
"Taken that have saved my desire,",5.0,hymns,0.740818440914154,0.5859,dk,0.9117186069488525,0.7492123246192932,0.0,0.0
If I myself among dead kinsmen,3.5,hymns,-0.4915259480476379,-0.6486,dk,0.0,-0.7632947564125061,0.0,0.0
Going with grief and death in breast,2.5,hymns,-0.7113375663757324,-0.8074,dk,-0.9460890293121338,-0.8815369606018066,0.0,0.0
Whether my happiness is progressing abruptly,3.0,hymns,-0.818436861038208,0.5574,dk,0.0,-0.5036027431488037,0.0,0.6739103198051453
Into a Bellter Mørk Night:,3.5,hymns,0.0,0.0,dk,0.0,0.0,0.0,0.0
"Therefore, however, the hope is not slipping,",6.0,hymns,0.6078183054924011,0.6956,dk,0.6586401462554932,0.4860607087612152,0.0,0.0
"You, my God, Me dont let go!",6.0,hymns,0.4237125217914581,0.3382,dk,0.8151001930236816,0.5424990057945251,0.0,0.9965812563896179
"What you give, glad I take,",6.5,hymns,0.6564151644706726,0.34,dk,0.9782009124755859,0.8751634359359741,0.9999521970748901,0.9877622127532959
