text,label,category,tr_xlm_roberta,vader,org_lang,twitter_xlm_roberta_base_sentiment_multilingual,xlm_roberta_base_sentiment_multilingual,memo_bert_sa,da_sentiment_base
The fish just moved away slowly and the old man could not raise him an inch.,4.5,prose,-0.7700472474098206,0.0,en,-0.9378069043159485,-0.7661235928535461,0.0,0.8893964886665344
His line was strong and made for heavy fish and he held it against his back until it was so taut that beads of water were jumping from it.,5.0,prose,0.0,0.5106,en,0.0,0.0,-0.9999494552612305,0.0
"Then it began to make a slow hissing sound in the water and he still held it, bracing himself against the thwart and leaning back against the pull.",5.0,prose,0.0,0.0,en,0.0,0.0,0.0,0.0
The boat began to move slowly off toward the North-West.,5.0,prose,0.0,0.0,en,0.0,0.0,0.0,0.0
The fish moved steadily and they travelled slowly on the calm water.,5.5,prose,0.5409514307975769,0.3182,en,0.9193786978721619,0.6779690980911255,0.0,0.0
The other baits were still in the water but there was nothing to be done.,5.0,prose,0.0,0.0,en,0.0,-0.5572976469993591,0.0,0.0
"""I wish I had the boy,"" the old man said aloud.",4.0,prose,-0.4986209869384765,0.4019,en,-0.769733726978302,0.7466617822647095,0.0,-0.598859965801239
"""I'm being towed by a fish and I'm the towing bitt.",4.5,prose,0.0,0.0,en,0.0,0.0,0.0,0.0
I could make the line fast.,4.5,prose,0.0,0.0,en,0.0,0.7188277244567871,0.0,0.0
But then he could break it.,4.0,prose,-0.5869183540344238,0.0,en,-0.6847875118255615,-0.6910774111747742,0.0,0.0
I must hold him all I can and give him line when he must have it.,4.5,prose,0.0,0.0,en,0.7617154121398926,0.0,0.0,0.994517982006073
"Thank God he is travelling and not going down.""",6.5,prose,0.6631661653518677,0.5574,en,0.930794358253479,0.7818667888641357,0.0,0.9964703321456909
"What I will do if he decides to go down, I don't know.",4.0,prose,0.0,0.0,en,0.0,0.0,0.0,0.9631046652793884
What I'll do if he sounds and dies I don't know.,4.0,prose,-0.5041704773902893,0.0,en,-0.5548409819602966,0.0,0.0,0.9692655801773071
But I'll do something.,5.5,prose,0.0,0.0,en,0.0,0.732030987739563,0.0,0.0
There are plenty of things I can do.,6.5,prose,0.6123970746994019,0.0,en,0.8938735127449036,0.861308217048645,0.0,0.0
He held the line against his back and watched its slant in the water and the skiff moving steadily to the North-West.,5.0,prose,0.0,0.0,en,0.0,0.0,0.0,0.0
"This will kill him, the old man thought.",4.0,prose,-0.8958233594894409,-0.6908,en,-0.9678589701652527,-0.9136582612991333,0.0,0.0
He can't do this forever.,4.5,prose,-0.8232523202896118,0.0,en,-0.9536928534507751,-0.8458638787269592,0.0,0.7748726606369019
"But four hours later the fish was still swimming steadily out to sea, towing the skiff, and the old man was still braced solidly with the line across his back.",5.0,prose,0.0,0.0,en,0.0,0.0,0.5073744058609009,0.0
"""It was noon when I hooked him,"" he said.",5.0,prose,0.0,0.0,en,0.0,0.8019448518753052,0.0,0.0
"""And I have never seen him.""",5.0,prose,0.0,0.0,en,-0.7924166917800903,-0.5759217739105225,0.0,0.0
He had pushed his straw hat hard down on his head before he hooked the fish and it was cutting his forehead.,4.0,prose,-0.4947725236415863,-0.2263,en,-0.8047189712524414,-0.8385168313980103,-0.9975946545600891,0.0
"He was thirsty too and he got down on his knees and, being careful not to jerk on the line, moved as far into the bow as he could get and reached the water bottle with one hand.",4.0,prose,0.0,0.738,en,0.0,-0.6365116238594055,0.0,0.9661832451820374
He opened it and drank a little.,5.5,prose,0.0,0.0,en,0.0,0.0,0.0,0.0
Then he rested against the bow.,6.0,prose,0.0,0.0,en,0.0,0.0,0.0,0.0
He rested sitting on the un-stepped mast and sail and tried not to think but only to endure.,5.5,prose,0.0,0.0,en,0.0,-0.5365619659423828,0.0,0.0
Then he looked behind him and saw that no land was visible.,4.5,prose,0.0,-0.296,en,0.0,0.0,0.0,0.494301974773407
"That makes no difference, he thought.",5.0,prose,0.0,-0.296,en,0.0,0.0,0.0,0.0
I can always come in on the glow from Havana.,6.0,prose,0.861964225769043,0.0,en,0.9856134057044983,0.7633271217346191,0.0,0.0
There are two more hours before the sun sets and maybe he will come up before that.,5.0,prose,0.0,0.0,en,0.518205463886261,0.0,0.0,0.8464128971099854
If he doesn't maybe he will come up with the moon.,5.0,prose,0.0,0.0,en,0.0,0.0,0.0,0.9799894690513611
If he does not do that maybe he will come up with the sunrise.,5.0,prose,0.0,0.0,en,0.0,0.0,0.0,0.8584457039833069
I have no cramps and I feel strong.,7.0,prose,0.5559252500534058,0.2732,en,0.9710239768028259,0.8374903202056885,0.0,0.9888160228729248
It is he that has the hook in his mouth.,5.0,prose,0.0,0.0,en,0.0,0.0,0.0,0.0
But what a fish to pull like that.,6.0,prose,-0.4402213990688324,0.5023,en,-0.9107359647750854,-0.586295485496521,0.0,0.0
He must have his mouth shut tight on the wire.,4.5,prose,-0.8272368907928467,0.0,en,-0.9224384427070618,-0.5400004386901855,0.0,0.8671156764030457
I wish I could see him.,5.5,prose,0.0,0.4019,en,0.0,0.7682274580001831,0.0,0.0
I wish I could see him only once to know what I have against me.,4.5,prose,-0.5445659160614014,0.4019,en,0.0,0.0,0.0,0.9744389653205872
The fish never changed his course nor his direction all that night as far as the man could tell from watching the stars.,5.0,prose,0.0,0.0,en,0.0,0.0,0.0,0.0
It was cold after the sun went down and the old man's sweat dried cold on his back and his arms and his old legs.,2.5,prose,-0.8578154444694519,0.0,en,-0.9660638570785522,-0.8140801191329956,0.0,0.0
During the day he had taken the sack that covered the bait box and spread it in the sun to dry.,5.0,prose,0.0,0.0,en,0.0,0.0,0.0,0.0
After the sun went down he tied it around his neck so that it hung down over his back and he cautiously worked it down under the line that was across his shoulders now.,5.0,prose,0.0,0.0,en,0.0,0.0,0.0,0.0
The sack cushioned the line and he had found a way of leaning forward against the bow so that he was almost comfortable.,6.0,prose,0.0,0.4601,en,0.5142908692359924,0.510067880153656,0.0,0.8198676705360413
The position actually was only somewhat less intolerable; but he thought of it as almost comfortable.,6.0,prose,0.0,0.6137,en,0.0,0.4906481206417084,0.0,0.8818182945251465
"I can do nothing with him and he can do nothing with me, he thought.",4.5,prose,0.0,0.0,en,0.0,-0.6417184472084045,0.0,0.9620097875595093
Not as long as he keeps this up.,5.0,prose,0.0,0.0,en,-0.6448700428009033,0.0,0.0,0.9695879220962524
Once he stood up and urinated over the side of the skiff and looked at the stars and checked his course.,5.0,prose,0.0,0.0,en,0.0,0.0,0.0,0.0
The line showed like a phosphorescent streak in the water straight out from his shoulders.,5.5,prose,0.0,0.5267,en,0.0,0.0,0.0,0.0
"They were moving more slowly now and the glow of Havana was not so strong, so that he knew the current must be carrying them to the eastward.",4.5,prose,0.0,-0.5265,en,0.0,0.0,0.0,0.8903213739395142
"If I lose the glare of Havana we must be going more to the eastward, he thought.",4.0,prose,-0.6174944043159485,-0.4019,en,0.0,0.0,0.0,0.9241321086883545
For if the fish's course held true I must see it for many more hours.,5.0,prose,0.5401126742362976,0.4215,en,0.6958017945289612,0.0,-0.9986799359321594,0.9923170804977417
"I wonder how the baseball came out in the grand leagues today, he thought.",5.5,prose,0.0,0.4588,en,0.0,0.0,0.0,0.0
It would be wonderful to do this with a radio.,6.5,prose,0.8166650533676147,0.5719,en,0.9443625211715698,0.939197838306427,0.0,0.9924889802932739
"Then he thought, think of it always.",5.0,prose,0.0,0.0,en,0.0,0.0,0.0,0.0
Think of what you are doing.,5.0,prose,0.0,0.0,en,0.0,0.0,0.0,0.0
You must do nothing stupid.,4.5,prose,-0.5332231521606445,0.4168,en,0.0,0.3870947062969208,-0.9991416931152344,0.962146520614624
"Then he said aloud, ""I wish I had the boy.",4.5,prose,0.0,0.4019,en,0.0,0.7403835654258728,0.0,0.8527743220329285
"To help me and to see this.""",5.0,prose,0.6359599232673645,0.4019,en,0.8825129866600037,0.8839554190635681,0.0,0.0
"No one should be alone in their old age, he thought.",4.0,prose,-0.5922605395317078,-0.4939,en,0.0,-0.6000170707702637,0.0,0.0
But it is unavoidable.,4.0,prose,-0.5240057110786438,0.0,en,0.0,0.7176523804664612,0.0,0.0
I must remember to eat the tuna before he spoils in order to keep strong.,5.5,prose,0.0,0.5106,en,0.0,0.0,0.0,0.0
"Remember, no matter how little you want to, that you must eat him in the morning.",5.0,prose,0.0,-0.2682,en,0.0,0.0,0.0,0.9880334138870239
"Remember, he said to himself.",5.0,prose,0.0,0.0,en,0.0,0.0,0.0,0.0
During the night two porpoise came around the boat and he could hear them rolling and blowing.,5.0,prose,0.0,0.0,en,0.0,0.0,0.0,0.8872153759002686
He could tell the difference between the blowing noise the male made and the sighing blow of the female.,5.5,prose,0.0,0.0,en,0.0,0.0,0.0,0.7356492280960083
"""They are good,"" he said.",7.0,prose,0.8465589880943298,0.0,en,0.9827448725700378,0.9416624903678894,0.9999796152114868,0.9604394435882568
"""They play and make jokes and love one another.",8.5,prose,0.6537346839904785,0.8225,en,0.9135035276412964,0.8749839663505554,0.9994761347770691,0.7171503901481628
"They are our brothers like the flying fish.""",8.0,prose,0.0,0.3612,en,0.0,0.0,0.0,0.8484358191490173
Then he began to pity the great fish that he had hooked.,4.0,prose,-0.9027226567268372,0.4404,en,-0.9742138981819153,-0.922886073589325,0.9999769926071167,0.9399288892745972
"He is wonderful and strange and who knows how old he is, he thought.",7.0,prose,0.3464452624320984,0.4404,en,0.5696335434913635,0.6149358153343201,0.0,0.953386664390564
Never have I had such a strong fish nor one who acted so strangely.,6.0,prose,-0.436212420463562,0.1113,en,0.9305693507194519,0.7700419425964355,-0.9999707937240601,0.988379955291748
Perhaps he is too wise to jump.,6.5,prose,-0.6860613822937012,0.4767,en,-0.8473926782608032,0.0,0.0,0.0
He could ruin me by jumping or by a wild rush.,4.0,prose,-0.8198264837265015,-0.5859,en,-0.9282994866371155,-0.9017836451530457,-0.9999551773071289,0.0
But perhaps he has been hooked many times before and he knows that this is how he should make his fight.,5.0,prose,0.0,-0.5267,en,0.5867929458618164,0.0,0.0,0.9751356244087219
"He cannot know that it is only one man against him, nor that it is an old man.",4.5,prose,-0.6317477226257324,0.0,en,-0.6527458429336548,-0.5249509811401367,-0.9974299073219299,0.6185961961746216
But what a great fish he is and what he will bring in the market if the flesh is good.,7.0,prose,0.8847295045852661,0.8885,en,0.9642056226730347,0.9022924304008484,0.999981164932251,0.0
He took the bait like a male and he pulls like a male and his fight has no panic in it.,6.5,prose,0.0,-0.4767,en,0.0,0.4823225736618042,-0.9951255917549133,0.818043053150177
I wonder if he has any plans or if he is just as desperate as I am?,4.5,prose,-0.5191462635993958,-0.3182,en,0.0,0.0,-0.9238206148147583,0.8924162983894348
He remembered the time he had hooked one of a pair of marlin.,5.0,prose,0.0,0.0,en,0.0,0.0,0.0,0.0
"The male fish always let the female fish feed first and the hooked fish, the female, made a wild, panic-stricken, despairing fight that soon exhausted her, and all the time the male had stayed with her, crossing the line and circling with her on the surface.",3.5,prose,-0.6435248255729675,-0.8126,en,0.0,-0.8806501030921936,-0.9327226281166077,0.0
He had stayed so close that the old man was afraid he would cut the line with his tail which was sharp as a scythe and almost of that size and shape.,4.5,prose,-0.7918577194213867,-0.2732,en,-0.881464421749115,-0.7982003688812256,0.0,0.728157639503479
"When the old man had gaffed her and clubbed her, holding the rapier bill with its sandpaper edge and clubbing her across the top of her head until her colour turned to a colour almost like the backing of mirrors, and then, with the boy's aid, hoisted her aboard, the male fish had stayed by the side of the boat.",3.5,prose,0.0,0.4485,en,0.0,-0.5642763376235962,0.0,0.0
"Then, while the old man was clearing the lines and preparing the harpoon, the male fish jumped high into the air beside the boat to see where the female was and then went down deep, his lavender wings, that were his pectoral fins, spread wide and all his wide lavender stripes showing.",4.5,prose,0.0,0.0,en,0.0,0.0,0.0,0.0
"He was beautiful, the old man remembered, and he had stayed.",7.5,prose,0.8324851393699646,0.5994,en,0.9718546271324158,0.9050950407981873,0.9999628067016602,0.845609188079834
"That was the saddest thing I ever saw with them, the old man thought.",3.0,prose,-0.905626118183136,-0.6124,en,-0.9754205346107483,-0.9307336211204529,0.0,0.0
The boy was sad too and we begged her pardon and butchered her promptly.,3.0,prose,-0.8789826035499573,-0.2023,en,-0.7969935536384583,-0.8434231877326965,0.0,0.5702680945396423
"""I wish the boy was here,"" he said aloud and settled himself against the rounded planks of the bow and felt the strength of the great fish through the line he held across his shoulders moving steadily toward whatever he had chosen.",4.5,prose,0.4290654063224792,0.875,en,0.5994733572006226,0.6504725217819214,0.9997091889381409,0.0
"When once, through my treachery, it had been necessary to him to make a choice, the old man thought.",4.5,prose,-0.4502952098846435,0.0,en,0.0,-0.5162136554718018,0.0,0.0
His choice had been to stay in the deep dark water far out beyond all snares and traps and treacheries.,4.5,prose,-0.7650274634361267,0.0,en,-0.5182527303695679,0.0,0.0,0.0
My choice was to go there to find him beyond all people.,5.5,prose,0.0,0.0,en,0.0,0.0,0.0,0.7822062373161316
Beyond all people in the world.,5.0,prose,-0.4588121175765991,0.0,en,0.0,0.0,0.0,0.0
Now we are joined together and have been since noon.,5.0,prose,0.5254554152488708,0.0,en,0.0,0.8042998909950256,0.0,0.0
And no one to help either one of us.,3.0,prose,-0.727120578289032,0.128,en,-0.929476797580719,-0.8867725133895874,-0.9963950514793396,0.0
"Perhaps I should not have been a fisherman, he thought.",3.5,prose,-0.6591410040855408,0.0,en,-0.5794074535369873,-0.5041055083274841,0.0,0.0
But that was the thing that I was born for.,6.0,prose,0.4907551407814026,0.0,en,0.9239541888237,0.6865746974945068,0.0,0.0
I must surely remember to eat the tuna after it gets light.,5.0,prose,0.0,0.4404,en,0.0,0.526727020740509,0.0,0.0
Some time before daylight something took one of the baits that were behind him.,5.0,prose,0.0,0.0,en,0.0,0.0,0.0,0.8657858967781067
He heard the stick break and the line begin to rush out over the gunwale of the skiff.,5.0,prose,0.0,0.0,en,0.0,0.0,0.0,0.0
In the darkness he loosened his sheath knife and taking all the strain of the fish on his left shoulder he leaned back and cut the line against the wood of the gunwale.,5.0,prose,0.0,-0.5106,en,0.0,-0.5355901718139648,0.0,0.0
Then he cut the other line closest to him and in the dark made the loose ends of the reserve coils fast.,5.0,prose,0.0,-0.5267,en,0.0,0.0,0.0,0.0
He worked skillfully with the one hand and put his foot on the coils to hold them as he drew his knots tight.,5.0,prose,0.0,0.4939,en,0.0,0.0,0.9999276399612427,0.9752776622772217
Now he had six reserve coils of line.,5.0,prose,0.0,0.0,en,0.0,0.0,0.0,0.0
There were two from each bait he had severed and the two from the bait the fish had taken and they were all connected.,5.0,prose,0.0,-0.3612,en,0.0,0.0,0.0,0.0
"After it is light, he thought, I will work back to the forty-fathom bait and cut it away too and link up the reserve coils.",5.0,prose,0.0,-0.2732,en,0.0,0.0,0.0,0.6579481959342957
I will have lost two hundred fathoms of good Catalan cordel and the hooks and leaders.,3.5,prose,-0.7941972613334656,0.1531,en,-0.9629148244857788,-0.898627519607544,0.0,0.0
That can be replaced.,6.0,prose,0.0,0.0,en,0.0,0.0,0.0,0.0
But who replaces this fish if I hook some fish and it cuts him off?,4.5,prose,-0.8091087341308594,-0.4215,en,-0.9681367874145508,-0.6664864420890808,0.0,0.0
I don't know what that fish was that took the bait just now.,5.0,prose,-0.4896003603935241,0.0,en,-0.7237098217010498,0.0,0.0,0.0
It could have been a marlin or a broadbill or a shark.,5.0,prose,0.0,0.0,en,-0.5090164542198181,0.0,0.0,0.0
I never felt him.,4.5,prose,-0.662778377532959,0.0,en,-0.8609460592269897,-0.7737938165664673,0.0,0.0
I had to get rid of him too fast.,4.0,prose,-0.8393903970718384,0.0,en,-0.9510642290115356,-0.8424059748649597,0.0,0.5284496545791626
"Aloud he said, ""I wish I had the boy.""",4.5,prose,0.0,0.4019,en,0.0,0.5428235530853271,0.0,0.9236788153648376
"But you haven't got the boy, he thought.",4.0,prose,0.0,0.0,en,0.0,-0.5167723894119263,0.0,0.8489691615104675
"You have only yourself and you had better work back to the last line now, in the dark or not in the dark, and cut it away and hook up the two reserve coils.",5.5,prose,0.0,0.2023,en,0.0,0.0,0.0,0.9552984833717346
So he did it.,5.0,prose,0.0,0.0,en,0.0,0.45307043194770813,0.0,0.7621098160743713
It was difficult in the dark and once the fish made a surge that pulled him down on his face and made a cut below his eye.,5.0,prose,-0.68728107213974,-0.5574,en,-0.9247141480445862,-0.7010507583618164,0.0,0.0
The blood ran down his cheek a little way.,4.0,prose,-0.5727123618125916,0.0,en,-0.7561216354370117,-0.7727781534194946,0.0,0.0
But it coagulated and dried before it reached his chin and he worked his way back to the bow and rested against the wood.,4.5,prose,0.0,0.1531,en,0.0,0.0,0.0,0.0
"He adjusted the sack and carefully worked the line so that it came across a new part of his shoulders and, holding it anchored with his shoulders, he carefully felt the pull of the fish and then felt with his hand the progress of the skiff through the water.",5.0,prose,0.0,0.7906,en,0.0,0.0,0.0,0.951732873916626
"I wonder what he made that lurch for, he thought.",5.0,prose,0.0,0.0,en,0.0,-0.5575082302093506,0.0,0.0
The wire must have slipped on the great hill of his back.,5.0,prose,-0.8128095865249634,0.6249,en,-0.8837829828262329,-0.7867856025695801,0.9999775886535645,0.0
Certainly his back cannot feel as badly as mine does.,4.0,prose,-0.864856481552124,0.6065,en,-0.9439047574996948,-0.7200535535812378,0.0,0.977514922618866
"But he cannot pull this skiff forever, no matter how great he is.",4.5,prose,0.4400120377540588,0.6124,en,0.824174165725708,-0.7978224158287048,0.9998949766159058,0.7244738936424255
Now everything is cleared away that might make trouble and I have a big reserve of line; all that a man can ask.,6.5,prose,0.0,-0.3182,en,0.8589280247688293,0.5017356276512146,0.6554999351501465,0.6428347826004028
"""Fish,"" he said softly, aloud, ""I'll stay with you until I am dead.""",6.0,prose,0.0,0.0,en,0.88838130235672,0.7680308222770691,0.0,0.8909066915512085
"He'll stay with me too, I suppose, the old man thought and he waited for it to be light.",6.0,prose,0.0,0.0,en,0.0,0.0,0.0,0.9949789643287659
It was cold now in the time before daylight and he pushed against the wood to be warm.,4.5,prose,-0.4717475175857544,0.2263,en,0.0,0.0,0.0,0.0
"I can do it as long as he can, he thought.",4.5,prose,0.0,0.0,en,0.0,0.0,0.0,0.0
And in the first light the line extended out and down into the water.,5.0,prose,0.0,0.0,en,0.0,0.0,0.0,0.0
The boat moved steadily and when the first edge of the sun rose it was on the old man's right shoulder.,5.0,prose,0.0,0.0,en,0.0,0.0,0.0,0.0
"""He's headed north,"" the old man said.",5.0,prose,0.0,0.0,en,0.0,0.0,0.0,0.0
"The current will have set us far to the eastward, he thought.",4.5,prose,-0.7667043209075928,0.0,en,-0.9313516616821289,-0.6803276538848877,0.0,0.0
I wish he would turn with the current.,5.0,prose,-0.4839866757392883,0.4019,en,0.0,0.0,0.0,0.0
That would show that he was tiring.,5.0,prose,-0.8929194808006287,0.0,en,-0.7707495093345642,-0.6749475002288818,0.0,0.0
When the sun had risen further the old man realized that the fish was not tiring.,5.0,prose,0.0,0.0,en,0.6927680969238281,0.0,0.0,0.0
There was only one favorable sign.,6.0,prose,0.0,0.4767,en,0.0,0.8033266663551331,0.9999752044677734,0.0
The slant of the line showed he was swimming at a lesser depth.,5.5,prose,0.0,0.0,en,0.0,0.0,0.0,0.0
That did not necessarily mean that he would jump.,5.0,prose,0.0,0.0,en,0.0,0.0,0.0,0.898920476436615
But he might.,5.0,prose,0.0,0.0,en,0.0,0.0,0.0,0.0
"""God let him jump,"" the old man said.",5.5,prose,0.0,0.2732,en,-0.593803882598877,-0.35259875655174255,0.0,0.9885856509208679
"""I have enough line to handle him.""",5.5,prose,0.0,0.0,en,0.0,0.5221061110496521,0.0,0.0
"Maybe if I can increase the tension just a little it will hurt him and he will jump, he thought.",4.0,prose,-0.7822723388671875,-0.483,en,-0.8344100713729858,-0.8106350302696228,0.5467373728752136,0.8612226247787476
Now that it is daylight let him jump so that he'll fill the sacks along his backbone with air and then he cannot go deep to die.,5.0,prose,-0.4672571122646332,-0.5994,en,0.0,-0.45148104429244995,0.0,0.8497177362442017
"He tried to increase the tension, but the line had been taut up to the very edge of the breaking point since he had hooked the fish and he felt the harshness as he leaned back to pull and knew he could put no more strain on it.",3.5,prose,-0.5135143399238586,-0.5483,en,0.0,-0.5740646719932556,0.0,0.729781985282898
"I must not jerk it ever, he thought.",4.5,prose,-0.5821765661239624,0.2584,en,0.0,0.41855737566947937,0.0,0.9846921563148499
Each jerk widens the cut the hook makes and then when he does jump he might throw it.,4.5,prose,0.0,-0.5423,en,0.0,0.0,0.0,0.0
Anyway I feel better with the sun and for once I do not have to look into it.,6.5,prose,0.5645736455917358,0.4404,en,0.933141827583313,0.8465284109115601,-0.999091386795044,0.9925881028175354
There was yellow weed on the line but the old man knew that only made an added drag and he was pleased.,6.0,prose,0.455176442861557,0.3612,en,0.5903280973434448,0.7847737073898315,0.0,0.0
It was the yellow Gulf weed that had made so much phosphorescence in the night.,5.5,prose,0.0,0.0,en,-0.7764253616333008,-0.8478935956954956,0.0,0.0
"""Fish,"" he said, ""I love you and respect you very much.",8.5,prose,0.8749272227287292,0.8074,en,0.9836909174919128,0.895374059677124,0.9999806880950928,0.9902486205101013
"But I will kill you dead before this day ends.""",2.0,prose,-0.7150136828422546,-0.9382,en,-0.914627730846405,-0.8102404475212097,-0.9999583959579468,0.0
"Let us hope so, he thought.",6.0,prose,0.0,0.4404,en,0.5085967779159546,0.5008970499038696,0.0,-0.6364970803260803
A small bird came toward the skiff from the north.,5.0,prose,0.0,0.0,en,0.0,0.0,0.0,0.0
He was a warbler and flying very low over the water.,5.0,prose,0.0,-0.3384,en,0.0,0.0,0.0,0.0
The old man could see that he was very tired.,4.0,prose,-0.5396710634231567,-0.4927,en,0.0,-0.8377610445022583,0.9991768002510071,0.6621748805046082
The bird made the stern of the boat and rested there.,5.0,prose,0.0,0.0,en,0.0,0.0,0.0,0.0
Then he flew around the old man's head and rested on the line where he was more comfortable.,5.5,prose,0.0,0.5563,en,0.0,0.0,0.0,0.8787100315093994
"""How old are you?""",5.0,prose,0.0,0.0,en,0.0,0.0,0.0,0.0
the old man asked the bird.,5.0,prose,0.0,0.0,en,0.0,0.0,0.0,0.0
"""Is this your first trip?""",5.0,prose,0.0,0.0,en,0.0,0.0,0.0,0.7174220085144043
The bird looked at him when he spoke.,5.0,prose,0.0,0.0,en,0.5496178269386292,0.0,0.0,0.0
He was too tired even to examine the line and he teetered on it as his delicate feet gripped it fast.,4.0,prose,-0.5501244068145752,-0.4019,en,0.0,-0.833448052406311,0.0,0.0
"""It's steady,"" the old man told him.",6.0,prose,0.0,0.0,en,0.0,0.0,0.0,0.0
"""It's too steady.",4.0,prose,-0.8321125507354736,0.0,en,-0.9401390552520752,-0.8928534388542175,0.0,0.0
You shouldn't be that tired after a windless night.,4.0,prose,-0.7382841110229492,0.3412,en,-0.49773478507995605,0.44065138697624207,0.0,0.9492629170417786
"What are birds coming to?""",4.5,prose,0.0,0.0,en,0.0,0.0,0.0,0.0
"The hawks, he thought, that come out to sea to meet them.",5.0,prose,0.0,0.0,en,0.0,0.0,0.0,0.0
But he said nothing of this to the bird who could not understand him anyway and who would learn about the hawks soon enough.,5.0,prose,-0.7244760990142822,0.0,en,-0.8629302382469177,-0.7465905547142029,0.0,0.9048886299133301
"""Take a good rest, small bird,"" he said.",6.0,prose,0.5346635580062866,0.4404,en,0.8525364398956299,0.8153263330459595,0.999981164932251,0.9919196367263794
"""Then go in and take your chance like any man or bird or fish.""",6.0,prose,0.0,0.5423,en,0.5651674270629883,0.0,0.0,0.9778689742088318
It encouraged him to talk because his back had stiffened in the night and it hurt truly now.,5.5,prose,-0.8636539578437805,0.25,en,-0.9686346054077148,-0.9063274264335632,0.0,0.0
"""Stay at my house if you like, bird,"" he said.",6.5,prose,0.4436146318912506,0.3612,en,0.509864091873169,0.0,0.0,0.9952561259269714
"""I am sorry I cannot hoist the sail and take you in with the small breeze that is rising.",4.0,prose,-0.8565735220909119,-0.0772,en,-0.958616316318512,-0.823521614074707,0.0,0.7045250535011292
"But I am with a friend.""",6.5,prose,0.0,0.0,en,0.0,0.0,0.0,0.9339998960494995
Just then the fish gave a sudden lurch that pulled the old man down onto the bow and would have pulled him overboard if he had not braced himself and given some line.,4.0,prose,-0.6567605137825012,0.0,en,-0.8522277474403381,-0.8615782260894775,-0.9999638795852661,0.9715536832809448
The bird had flown up when the line jerked and the old man had not even seen him go.,4.5,prose,0.0,-0.2023,en,0.0,-0.7703742384910583,-0.9760264754295349,0.8855036497116089
He felt the line carefully with his right hand and noticed his hand was bleeding.,3.0,prose,0.0,0.7845,en,0.0,-0.5219468474388123,0.0,0.0
