text,label,category,tr_xlm_roberta,vader,org_lang,twitter_xlm_roberta_base_sentiment_multilingual,xlm_roberta_base_sentiment_multilingual,memo_bert_sa,da_sentiment_base
"Obscene bikinis hide in the dunes,",4.666666666666667,poetry,-0.6471941471099854,-0.6705,en,-0.6465762853622437,-0.7509096264839172,0.0,0.0
Breasts and hips a confectioner 's sugar,5.666666666666667,poetry,0.0,0.0,en,0.0,0.0,0.0,0.0
"Of little crystals, titillating the light,",5.666666666666667,poetry,0.0,0.0,en,0.6992579102516174,0.711187481880188,0.0,0.0
"While a green pool opens its eye,",5.0,poetry,0.0,0.0,en,0.7194406986236572,0.0,0.0,0.7219597101211548
Sick with what it has swallowed—,4.0,poetry,-0.93770170211792,-0.5106,en,-0.9815404415130615,-0.9239643812179565,0.0,0.8613284826278687
"Limbs, images, shrieks. Behind the concrete bunkers",3.0,poetry,-0.7466827630996704,0.0,en,0.0,0.0,0.0,0.0
Two lovers unstick themselves.,5.666666666666667,poetry,-0.6797316074371338,0.5267,en,0.0,-0.7410535216331482,0.0,0.0
"O white sea-crockery,",5.0,poetry,-0.7375102639198303,0.0,en,-0.9608762264251709,-0.473050057888031,0.0,0.0
"What cupped sighs, what salt in the throat...",4.666666666666667,poetry,-0.6402395367622375,0.0,en,-0.9222835898399353,-0.834342360496521,0.0,0.0
"And the onlooker, trembling,",4.333333333333333,poetry,-0.4647331833839416,-0.3612,en,-0.5757410526275635,-0.8548275828361511,0.0,0.0
Drawn like a long material,5.0,poetry,0.0,0.3612,en,0.0,0.0,0.0,0.0
"Through a still virulence,",4.333333333333333,poetry,0.0,0.0,en,0.0,-0.6656532883644104,0.0,0.0
"And a weed, hairy as privates.",5.0,poetry,-0.8883007764816284,0.0,en,-0.9210206270217896,-0.9192554950714111,0.0,0.9327510595321655
"On the balconies of the hotel, things are glittering.",5.666666666666667,poetry,0.6311830282211304,0.0,en,0.9613180160522461,0.9107090830802917,0.9997455477714539,0.0
"Things, things—",5.0,poetry,0.0,0.0,en,0.0,0.0,0.0,0.0
"Tubular steel wheelchairs, aluminum crutches.",4.666666666666667,poetry,0.0,0.0,en,0.0,0.0,0.0,0.0
Such salt-sweetness. Why should I walk,5.333333333333333,poetry,-0.8856829404830933,0.0,en,-0.9751478433609009,-0.8616276979446411,0.0,0.9912896156311035
"Beyond the breakwater, spotty with barnacles? I am not a nurse, white and attendant,",5.0,poetry,-0.8305773138999939,0.0,en,0.0,-0.8331672549247742,0.0,0.9546199440956116
I am not a smile.,4.0,poetry,-0.4837735295295715,-0.2755,en,-0.5045920014381409,-0.6178422570228577,0.9228901267051697,0.9950526356697083
"These children are after something, with hooks and cries,",4.0,poetry,0.0,-0.4019,en,-0.5196970701217651,0.0,0.0,0.0
And my heart too small to bandage their terrible faults.,2.6666666666666665,poetry,-0.900851845741272,-0.7351,en,-0.9482768774032593,-0.9231172204017639,0.0,0.0
"This is the side of a man: his red ribs,",5.0,poetry,0.0,0.0,en,0.0,0.0,0.0,0.0
"The nerves bursting like trees, and this is the surgeon:",4.0,poetry,0.0,0.2732,en,-0.7219635248184204,-0.6764563918113708,0.0,0.0
One mirrory eye—,5.0,poetry,-0.5379183292388916,0.0,en,-0.8293458223342896,0.0,0.0,0.0
A facet of knowledge.,5.0,poetry,0.0,0.0,en,0.0,0.5453859567642212,0.0,0.0
On a striped mattress in one room,5.0,poetry,0.0,0.0,en,0.0,0.0,0.0,0.0
An old man is vanishing.,3.3333333333333335,poetry,-0.9005283713340759,0.0,en,-0.9327433705329895,-0.6424486041069031,-0.9999738931655884,0.0
There is no help in his weeping wife.,3.0,poetry,-0.927988350391388,-0.34,en,-0.969982922077179,-0.914084792137146,-0.996370792388916,0.0
"Where are the eye-stones, yellow and valuable,",5.666666666666667,poetry,0.0,0.4767,en,0.0,0.0,0.0,0.0
"And the tongue, sapphire of ash.",5.0,poetry,0.0,0.0,en,0.0,0.0,0.0,0.0
A wedding-cake face in a paper frill.,5.0,poetry,0.0,0.0,en,0.0,0.0,0.0,0.0
How superior he is now.,5.666666666666667,poetry,0.8185145854949951,0.5423,en,0.9554026126861572,0.8501456379890442,0.9999786615371704,0.0
It is like possessing a saint.,6.0,poetry,-0.4120694696903229,0.3612,en,0.0,0.0,0.0,0.8508450984954834
The nurses in their wing-caps are no longer so beautiful;,4.0,poetry,-0.7233442664146423,0.4576,en,-0.8891078233718872,-0.9077709913253784,0.9904166460037231,0.8764657378196716
"They are browning, like touched gardenias.",3.3333333333333335,poetry,-0.8942327499389648,0.3612,en,-0.962000846862793,-0.7354608178138733,0.0,0.9919368028640747
The bed is rolled from the wall.,5.0,poetry,0.0,0.0,en,0.0,0.0,0.0,0.0
This is what it is to be complete. It is horrible.,3.0,poetry,-0.95954167842865,-0.5423,en,-0.9820839166641235,-0.9483671188354492,0.0,0.0
Is he wearing pajamas or an evening suit,5.0,poetry,0.0,0.0,en,0.0,0.0,0.0,0.0
Under the glued sheet from which his powdery beak,5.0,poetry,0.0,0.0,en,0.0,0.0,0.0,0.0
Rises so whitely unbuffeted?,5.0,poetry,-0.712416410446167,0.0,en,-0.6722486615180969,-0.7929980158805847,0.0,0.0
They propped his jaw with a book until it stiffened,4.333333333333333,poetry,-0.75868821144104,0.0,en,-0.8870059847831726,-0.5160935521125793,0.0,0.0
"And folded his hands, that were shaking: goodbye, goodbye.",3.6666666666666665,poetry,-0.4047088623046875,-0.1779,en,0.0,-0.8103115558624268,0.0,0.0
"Now the washed sheets fly in the sun,",6.0,poetry,0.0,0.0,en,0.0,0.0,0.0,0.0
The pillow cases are sweetening.,5.666666666666667,poetry,0.8395568132400513,0.0,en,0.9829613566398621,0.9336390495300293,0.0,0.8178462982177734
"It is a blessing, it is a blessing:",7.666666666666667,poetry,0.8936529159545898,0.7506,en,0.9820927381515503,0.8932702541351318,0.0,0.0
"The long coffin of soap-colored oak,",4.333333333333333,poetry,0.0,0.0,en,0.0,0.0,0.0,0.0
The curious bearers and the raw date,5.0,poetry,0.0,0.3182,en,0.0,0.0,0.0,0.0
Engraving itself in silver with marvelous calm.,7.0,poetry,0.7318688631057739,0.7351,en,0.9645386338233948,0.931698203086853,0.0,0.909817636013031
"The grey sky lowers, the hills like a green sea",5.666666666666667,poetry,0.0,0.296,en,0.8859516382217407,0.0,0.0,0.0
"Run fold upon fold far off, concealing their hollows,",5.666666666666667,poetry,0.0,0.0,en,0.0,-0.43832698464393616,0.0,0.0
The hollows in which rock the thoughts of the wife—,5.0,poetry,0.0,0.0,en,0.0,0.7341370582580566,0.0,0.0
"Blunt, practical boats",5.0,poetry,-0.7032540440559387,0.0,en,0.0,0.587122917175293,0.0,0.0
Full of dresses and hats and china and married daughters.,5.666666666666667,poetry,0.0,0.0,en,0.0,0.0,0.0,0.0
In the parlor of the stone house,5.0,poetry,0.0,0.0,en,0.0,0.0,0.0,0.0
"One curtain is flickering from the open window,",5.0,poetry,0.0,0.0,en,0.0,0.0,0.0,0.0
"Flickering and pouring, a pitiful candle.",4.333333333333333,poetry,-0.8784940838813782,-0.4939,en,-0.9787919521331787,-0.9228166341781616,0.0,0.0
"This is the tongue of the dead man: remember, remember.",3.6666666666666665,poetry,0.0,-0.6486,en,0.0,-0.5402432084083557,0.0,0.0
"How far he is now, his actions",5.0,poetry,0.0,0.0,en,0.0,0.0,0.0,0.0
"Around him like livingroom furniture, like a décor.",5.0,poetry,0.0,0.6124,en,0.0,0.0,0.0,0.9953761100769043
As the pallors gather—,4.333333333333333,poetry,0.0,0.0,en,0.0,0.0,0.0,0.0
"The pallors of hands and neighborly faces,",4.666666666666667,poetry,0.0,0.0,en,0.0,0.0,0.0,0.0
The elate pallors of flying iris.,4.0,poetry,-0.3817819952964782,0.0,en,0.0,0.4778001308441162,0.0,0.0
They are flying off into nothing: remember us.,3.6666666666666665,poetry,0.0,0.0,en,0.0,0.0,0.0,0.0
"The empty benches of memory look over stones,",4.0,poetry,0.0,-0.2023,en,0.0,0.0,0.0,0.0
"Marble facades with blue veins, and jelly-glassfuls of daffodils.",5.333333333333333,poetry,0.0,0.0,en,0.0,0.0,0.0,0.9934086799621582
It is so beautiful up here: it is a stopping place.,6.666666666666667,poetry,0.7804757356643677,0.6588,en,0.9789109230041504,0.9336746335029602,0.9999823570251465,0.8831837177276611
The natural fatness of these lime leaves! —,6.0,poetry,-0.7725642919540405,0.4199,en,-0.9276991486549377,0.8989714980125427,-0.9993792772293091,0.992315411567688
"Pollarded green balls, the trees march to church.",5.0,poetry,0.0,0.0,en,0.0,0.0,0.0,0.0
"The voice of the priest, in thin air,",5.0,poetry,0.0,0.0,en,0.0,0.0,0.0,0.0
"Meets the corpse at the gate,",3.6666666666666665,poetry,0.0,-0.5719,en,0.0,0.0,0.0,0.0
"Addressing it, while the hills roll the notes of the dead bell;",4.0,poetry,0.0,-0.6486,en,0.0,0.0,0.0,0.0
A glitter of wheat and crude earth.,4.333333333333333,poetry,-0.4377476871013641,-0.5719,en,-0.8914613127708435,0.48948055505752563,0.0,0.0
What is the name of that color?—,5.0,poetry,0.0,0.0,en,0.0,0.0,0.0,0.0
"Old blood of caked walls the sun heals,",4.666666666666667,poetry,-0.391248345375061,0.0,en,0.0,0.39181914925575256,0.0,0.0
"Old blood of limb stumps, burnt hearts.",3.3333333333333335,poetry,-0.929520547389984,0.0,en,-0.9740549325942993,-0.8997837901115417,0.0,0.0
"The widow with her black pocketbook and three daughters,",4.666666666666667,poetry,0.0,0.0,en,0.0,0.0,0.0,0.0
"Necessary among the flowers,",5.0,poetry,0.0,0.0,en,0.0,0.0,0.0,0.0
"Enfolds her face like fine linen,",5.666666666666667,poetry,0.0,0.5106,en,0.8335609436035156,0.0,0.0,0.8742969036102295
Not to be spread again.,5.0,poetry,-0.8286730051040649,0.0,en,-0.9527145624160767,-0.6523073315620422,0.0,0.0
"While a sky, wormy with put-by smiles,",4.333333333333333,poetry,0.0,0.4767,en,0.6097527146339417,-0.9087879657745361,0.6514573097229004,0.917037308216095
Passes cloud after cloud.,5.0,poetry,0.0,0.0,en,0.0,0.0,0.0,0.0
"And the bride flowers expend a freshness,",6.666666666666667,poetry,0.604278028011322,0.0,en,0.9172433018684387,0.8448320627212524,0.0,0.0
And the soul is a bride,6.666666666666667,poetry,0.0,0.0,en,0.0,0.0,0.9998840093612671,0.0
"In a still place, and the groom is red and forgetful, he is featureless.",4.666666666666667,poetry,-0.832529604434967,-0.2732,en,0.0,-0.8705293536186218,0.0,0.9897046685218811
Behind the glass of this car,5.0,poetry,0.0,0.0,en,0.0,0.0,0.0,0.0
"The world purrs, shut-off and gentle.",6.333333333333333,poetry,-0.6394065022468567,0.4404,en,0.5525323152542114,-0.5167061686515808,0.0,0.0
"And I am dark-suited and still, a member of the party,",4.333333333333333,poetry,0.0,0.4019,en,0.5125345587730408,0.0,0.0,0.0
Gliding up in low gear behind the cart.,5.0,poetry,0.0,-0.2732,en,0.0,0.0,0.0,0.0
"And the priest is a vessel,",4.666666666666667,poetry,0.0,0.0,en,0.0,0.0,0.0,0.0
"A tarred fabric, sorry and dull,",3.6666666666666665,poetry,-0.9185028076171876,-0.4588,en,-0.9316998720169067,-0.9190185070037842,0.0,0.0
"Following the coffin on its flowery cart like a beautiful woman,",6.333333333333333,poetry,0.5889337062835693,0.7506,en,0.9472589492797852,0.9125213623046875,0.9999558925628662,0.9971932768821716
"A crest of breasts, eyelids and lips",5.333333333333333,poetry,0.0,0.0,en,0.0,0.0,0.0,0.0
Storming the hilltop.,5.0,poetry,0.0,0.0,en,0.4937233030796051,-0.8152050971984863,0.0,0.0
"Then, from the barred yard, the children",5.0,poetry,0.0,0.0,en,0.0,0.0,0.0,0.0
"Smell the melt of shoe-blacking,",5.0,poetry,-0.4010346531867981,0.0,en,-0.409405380487442,-0.6719875931739807,0.0,0.0
"Their faces turning, wordless and slow,",4.0,poetry,-0.5088329911231995,0.0,en,0.0,-0.6738652586936951,0.0,0.0
Their eyes opening,5.0,poetry,0.4607474207878113,0.0,en,0.9434811472892761,0.0,0.0,0.0
On a wonderful thing—,7.0,poetry,0.9190096259117126,0.5719,en,0.9823364615440369,0.9229387640953064,0.9978398084640503,0.9778703451156616
"Six round black hats in the grass and a lozenge of wood,",5.0,poetry,0.0,0.0,en,0.0,0.0,0.0,0.0
"And a naked mouth, red and awkward.",5.0,poetry,-0.7093244194984436,-0.1531,en,-0.6857461333274841,-0.9361670017242432,0.0,0.8231303095817566
For a minute the sky pours into the hole like plasma.,4.666666666666667,poetry,0.0,0.3612,en,0.0,0.0,0.0,0.0
"There is no hope, it is given up.",2.0,poetry,-0.6611575484275818,0.1779,en,-0.6246781945228577,-0.8536811470985413,0.0,0.0
ARIEL,5.0,poetry,0.0,0.0,en,0.0,0.0,0.0,0.0
Stasis in darkness.,4.333333333333333,poetry,-0.5630141496658325,-0.25,en,0.0,-0.8245068192481995,0.0,0.0
Then the substanceless blue,5.333333333333333,poetry,-0.4029838740825653,0.0,en,0.0,-0.6330258846282959,0.0,0.0
Pour of tor and distances.,4.666666666666667,poetry,0.0,0.0,en,0.0,0.0,0.0,0.0
"God's lioness,",6.666666666666667,poetry,0.5018407702445984,0.0,en,0.8300573825836182,0.6263269782066345,0.0,0.987933874130249
"How one we grow,",5.666666666666667,poetry,0.4865487217903137,0.0,en,0.6064753532409668,0.8652632832527161,0.0,0.0
Pivot of heels and knees! —The furrow,5.0,poetry,0.0,0.0,en,0.6815879940986633,-0.7654937505722046,0.0,0.9958484172821045
"Splits and passes, sister to",5.0,poetry,0.0,0.0,en,0.0,0.0,0.0,0.0
The brown arc,5.0,poetry,0.0,0.0,en,0.0,0.0,0.0,0.0
"Of the neck I cannot catch,",4.666666666666667,poetry,-0.6193065643310547,0.0,en,0.0,-0.7240825891494751,0.0,0.0
Nigger-eye,5.0,poetry,-0.5472629070281982,0.0,en,-0.8942345976829529,0.0,0.0,0.0
Berries cast dark,4.666666666666667,poetry,0.0,0.0,en,0.0,-0.7227811813354492,0.0,0.0
Hooks—,4.666666666666667,poetry,0.0,0.0,en,0.0,0.0,0.0,0.0
"Black sweet blood mouthfuls,",4.333333333333333,poetry,-0.410620629787445,0.4588,en,-0.9200267791748047,0.7558682560920715,0.0,0.0
Shadows.,5.0,poetry,0.0,0.0,en,0.0,0.0,0.0,0.0
Something else,5.0,poetry,0.0,0.0,en,0.0,0.0,0.0,0.0
Hauls me through air—,4.666666666666667,poetry,-0.4370489418506622,0.0,en,0.0,0.0,0.0,0.0
"Thighs, hair;",5.0,poetry,0.0,0.0,en,0.0,0.0,0.0,0.0
Flakes from my heels.,4.666666666666667,poetry,0.0,0.0,en,0.0,-0.6088764071464539,0.0,0.0
White,5.0,poetry,0.0,0.0,en,0.0,0.0,0.0,0.0
"Godiva, I unpeel—",5.333333333333333,poetry,-0.8190300464630127,0.0,en,-0.9489763975143433,-0.3553118407726288,0.0,0.9986767172813416
"Dead hands, dead stringencies.",3.6666666666666665,poetry,-0.8297367095947266,-0.8625,en,-0.9624903798103333,-0.8959171175956726,0.0,0.0
And now I,5.0,poetry,0.0,0.0,en,-0.5141798853874207,0.0,0.0,0.0
"Foam to wheat, a glitter of seas.",5.666666666666667,poetry,0.4216300547122955,0.0,en,0.0,0.0,0.0,0.0
The child cry,3.3333333333333335,poetry,-0.6457294225692749,-0.4767,en,-0.9032168984413147,-0.8564350008964539,0.0,0.0
Melts in the wall.,4.666666666666667,poetry,-0.6560483574867249,0.0,en,0.0,-0.8313273191452026,0.0,0.0
And I,5.0,poetry,0.0,0.0,en,0.0,0.0,0.0,0.0
"Am the arrow,",5.0,poetry,0.0,0.0,en,0.0,0.0,0.0,0.0
The dew that flies,5.0,poetry,0.0,0.0,en,0.0,-0.6321628093719482,0.0,0.0
"Suicidal, at one with the drive",3.3333333333333335,poetry,-0.811454713344574,-0.6705,en,-0.8587818741798401,-0.7688300013542175,0.0,0.0
Into the red,5.0,poetry,0.0,0.0,en,0.0,0.0,0.0,0.0
"Eye, the cauldron of morning.",5.666666666666667,poetry,0.0,0.0,en,0.0,0.4707118272781372,0.0,0.0
DEATH & CO.,3.0,poetry,-0.6692789793014526,-0.5994,en,-0.92460697889328,-0.5623434782028198,0.0,0.0
"Two, of course there are two.",5.0,poetry,0.0,0.0,en,0.0,0.0,0.0,0.0
It seems perfectly natural now—,6.333333333333333,poetry,0.0,0.7717,en,0.8861436247825623,0.8679272532463074,0.9999817609786987,0.9803130030632019
"The one who never looks up, whose eyes are lidded",4.333333333333333,poetry,-0.5267070531845093,0.0,en,0.0,-0.7944564819335938,0.0,0.9491154551506042
"And balled, like Blake's,",5.0,poetry,0.0,0.3612,en,0.0,-0.538844883441925,0.0,0.9973770380020142
Who exhibits,5.0,poetry,0.0,0.0,en,0.0,0.0,0.0,0.0
The birthmarks that are his trademark—,5.0,poetry,0.0,0.0,en,0.0,0.0,0.0,0.0
"The scald scar of water,",3.6666666666666665,poetry,-0.871651828289032,0.0,en,-0.9549083113670349,-0.8033521771430969,0.0,0.0
The nude,5.0,poetry,0.0,0.0,en,0.0,0.6211458444595337,0.0,0.0
Verdigris of the condor.,5.0,poetry,0.4545030891895294,0.0,en,0.806242048740387,-0.5215796232223511,0.0,0.0
I am red meat. His beak,4.666666666666667,poetry,-0.7107475399971008,0.0,en,-0.890378475189209,-0.4392179250717163,0.0,0.0
Claps sidewise: I am not his yet.,5.666666666666667,poetry,0.0,0.0,en,0.0,0.0,0.0,0.0
He tells me how badly I photograph.,4.0,poetry,-0.5062797665596008,-0.4767,en,-0.8039873838424683,-0.9008857011795044,0.0,0.886560320854187
He tells me how sweet,6.666666666666667,poetry,0.8442159295082092,0.4588,en,0.9677883982658386,0.9301466941833496,0.5479723215103149,0.9372141361236572
The babies look in their hospital,5.0,poetry,0.0,0.0,en,0.0,0.0,0.0,0.0
"Icebox, a simple",5.0,poetry,0.0,0.0,en,0.0,0.0,0.0,0.0
"Frill at the neck,",5.0,poetry,0.0,0.0,en,0.0,-0.4513344168663025,0.0,0.0
Then the flutings of their lonian,5.0,poetry,0.0,0.0,en,0.0,-0.7314893007278442,0.0,0.0
"Death-gowns,",3.3333333333333335,poetry,-0.4225237369537353,0.0,en,0.0,-0.572631299495697,0.0,0.0
Then two little feet.,5.333333333333333,poetry,0.0,0.0,en,0.0,0.0,0.0,0.0
He does not smile or smoke.,4.666666666666667,poetry,-0.567127525806427,-0.2755,en,-0.6564471125602722,-0.5972369313240051,-0.9999638795852661,0.9561898708343506
"The other does that,",5.0,poetry,0.0,0.0,en,0.0,0.0,0.0,0.0
His hair long and plausive.,5.0,poetry,0.7779017090797424,0.0,en,0.9345908761024475,0.84919273853302,0.0,0.0
Bastard,4.0,poetry,-0.8933207392692566,-0.5423,en,-0.9710085391998291,0.0,0.0,0.0
"Masturbating a glitter,",4.333333333333333,poetry,0.0,0.0,en,0.0,0.4596130847930908,0.0,0.0
He wants to be loved.,4.666666666666667,poetry,0.0,0.5994,en,0.5689428448677063,0.7101589441299438,0.9998462200164795,0.9925071597099304
I do not stir.,5.0,poetry,0.0,0.0,en,0.0,0.5743958353996277,0.0,0.0
"The frost makes a flower,",6.0,poetry,0.0,0.0,en,0.0,0.7686980366706848,0.0,0.0
"The dew makes a star,",6.333333333333333,poetry,0.6061432361602783,0.0,en,0.8776190876960754,0.6818651556968689,0.0,0.0
"The dead bell,",3.6666666666666665,poetry,0.0,-0.6486,en,0.0,-0.613801121711731,0.0,0.0
The dead bell.,3.6666666666666665,poetry,0.0,-0.6486,en,0.0,-0.6975129246711731,0.0,0.0
Somebody done for.,4.0,poetry,-0.5092376470565796,0.0,en,0.0,0.0,0.0,0.0
NICK AND THE CLANDESTICK,5.0,poetry,-0.6856773495674133,0.0,en,0.0,0.0,0.0,0.0
I am a miner. The light burns blue.,5.0,poetry,0.0,0.0,en,0.0,0.0,0.0,0.0
Waxy stalactites,5.333333333333333,poetry,0.0,0.0,en,-0.5858405828475952,0.0,0.0,0.0
"Drip and thicken, tears",4.0,poetry,-0.8721131682395935,-0.2263,en,-0.8828535676002502,-0.9018396735191345,0.0,0.0
The earthen womb,5.0,poetry,-0.6850359439849854,0.0,en,0.0,0.0,0.0,0.0
Exudes from its dead boredom.,3.3333333333333335,poetry,-0.8350970149040222,-0.765,en,-0.7299327850341797,-0.6605685949325562,0.0,0.0
Black bat airs,4.333333333333333,poetry,-0.3940510749816894,0.0,en,0.0,0.0,0.0,0.0
"Wrap me, raggy shawls,",4.333333333333333,poetry,0.0,0.0,en,0.0,0.40233561396598816,0.0,0.0
Cold homicides.,2.6666666666666665,poetry,-0.9133684635162354,0.0,en,-0.9730618000030518,-0.9067463874816895,0.0,0.0
They weld to me like plums.,5.0,poetry,0.0,0.3612,en,0.0,0.0,0.0,0.9825846552848816
Old cave of calcium,5.0,poetry,-0.634201169013977,0.0,en,-0.726220428943634,0.0,0.0,0.0
"Icicles, old echoer.",4.666666666666667,poetry,0.0,0.0,en,0.0,0.0,0.0,0.0
"Even the newts are white,",4.666666666666667,poetry,-0.5734082460403442,0.0,en,0.0,0.0,0.0,0.0
Those holy Joes.,5.0,poetry,0.5959473252296448,0.0,en,0.8591905236244202,0.9139277935028076,0.0,0.0
"And the fish, the fish—",5.0,poetry,0.0,0.0,en,0.0,0.0,0.0,0.0
"Christ! they are panes of ice,",4.333333333333333,poetry,-0.4978091716766357,0.0,en,-0.8754405379295349,-0.46971920132637024,0.0,0.0
"A vice of knives,",4.0,poetry,-0.9099885821342468,0.0,en,-0.9705303311347961,-0.9234206676483154,0.0,0.0
A piranha,4.666666666666667,poetry,-0.8070367574691772,0.0,en,-0.9794568419456482,0.0,0.0,0.0
"Religion, drinking",5.0,poetry,0.0,0.0,en,0.0,0.0,0.0,0.0
Its first communion out of my live toes.,4.666666666666667,poetry,0.0,0.0,en,0.0,0.8095734119415283,0.0,0.0
The candle,5.0,poetry,0.0,0.0,en,0.0,0.0,0.0,0.0
"Gulps and recovers its small altitude,",5.333333333333333,poetry,0.0,0.0,en,0.0,0.0,0.0,0.0
Its yellows hearten.,5.0,poetry,-0.5005578398704529,0.0,en,-0.7659251689910889,0.5042683482170105,0.0,0.0
"O love, how did you get here?",5.0,poetry,0.0,0.6369,en,0.4973052740097046,0.0,0.0,0.0
O embryo,5.0,poetry,0.0,0.0,en,0.0,0.0,0.0,0.0
"Remembering, even in sleep,",5.0,poetry,0.0,0.0,en,0.0,0.0,0.0,0.0
Your crossed position.,4.666666666666667,poetry,-0.467227965593338,0.0,en,-0.5174320340156555,0.0,0.0,0.0
The blood blooms clean,4.333333333333333,poetry,0.5859552621841431,0.4019,en,0.9326260685920715,0.7475735545158386,0.0,0.0
"In you, ruby.",5.0,poetry,0.6461591720581055,0.0,en,0.9461495280265808,0.5914191603660583,0.0,0.4759022891521454
The pain,3.3333333333333335,poetry,-0.8074647188186646,-0.5106,en,-0.7570273280143738,-0.8859652876853943,0.0,0.0
You wake to is not yours.,5.333333333333333,poetry,0.0,0.0,en,0.0,-0.6634039282798767,0.0,0.9863556027412415
"Love, love,",7.666666666666667,poetry,0.5987866520881653,0.8555,en,0.831325888633728,0.8871209025382996,0.0,0.0
"I have hung our cave with roses,",5.0,poetry,0.0,0.0,en,0.7221056222915649,0.7449463605880737,0.9999768733978271,0.9703867435455322
With soft rugs—,6.0,poetry,0.0,0.0,en,0.0,0.5351604223251343,0.0,0.0
The last of Victoriana.,5.0,poetry,0.0,0.0,en,0.0,0.0,0.0,0.0
Let the stars,6.0,poetry,0.0,0.0,en,0.0,0.0,0.0,0.0
"Plummet to their dark address,",3.6666666666666665,poetry,-0.4949114322662353,0.0,en,-0.6134566068649292,-0.5741838812828064,0.0,0.0
Let the mercuric,5.333333333333333,poetry,0.0,0.0,en,0.0,-0.5011980533599854,0.0,0.0
Atoms that cripple drip,3.6666666666666665,poetry,-0.9187142252922058,0.0,en,-0.969515323638916,-0.6949092745780945,0.0,0.0
"Into the terrible well,",3.3333333333333335,poetry,-0.8729621767997742,-0.25,en,-0.9601171612739563,-0.7395851612091064,0.0,0.0
You are the one,5.333333333333333,poetry,0.7538699507713318,0.0,en,0.9589992165565491,0.8585075736045837,0.0,0.0
"Solid the spaces lean on, envious.",3.6666666666666665,poetry,0.8064193725585938,-0.128,en,0.846237301826477,-0.6464480757713318,0.0,0.0
You are the baby in the barn.,4.666666666666667,poetry,0.0,0.0,en,0.0,0.0,0.0,0.0
GULLIVER,5.0,poetry,-0.4590391516685486,0.0,en,-0.7783626914024353,0.40497100353240967,0.0,0.0
Over your body the clouds go,5.333333333333333,poetry,0.0,0.0,en,0.0,0.0,0.0,0.0
"High, high and icily",5.333333333333333,poetry,0.0,0.0,en,0.49515897035598755,0.0,0.0,0.0
"And a little flat, as if they",5.333333333333333,poetry,-0.5500476360321045,0.0,en,0.0,-0.8246589303016663,0.0,0.9125087261199951
Floated on a glass that was invisible.,5.333333333333333,poetry,0.0,0.0,en,0.0,0.0,0.0,0.0
"Unlike swans,",5.0,poetry,-0.6403527855873108,0.0,en,-0.7398607134819031,0.0,0.0,0.0
Having no reflections;,4.666666666666667,poetry,0.0,-0.296,en,0.0,-0.6553022265434265,0.0,0.0
"Unlike you,",5.0,poetry,-0.4366059005260467,0.0,en,-0.441172331571579,-0.7592202425003052,0.0,0.0
With no strings attached.,5.333333333333333,poetry,0.0,-0.296,en,0.0,0.0,0.0,0.0
"AÍI cool, all blue. Unlike you—",5.333333333333333,poetry,0.6971848607063293,0.3182,en,0.9773486852645874,0.9010409116744995,0.0,0.9982060194015503
"You, there on your back,",5.0,poetry,0.0,0.0,en,0.0,0.0,0.0,0.0
Eyes to the sky.,5.333333333333333,poetry,0.0,0.0,en,0.8832910656929016,0.5125323534011841,0.0,0.0
"The spider-men have caught you,",4.666666666666667,poetry,-0.7670631408691406,0.0,en,-0.9490513801574707,-0.8329471945762634,0.0,0.0
"Winding and twining their petty fetters,",4.0,poetry,-0.8012896776199341,-0.2023,en,-0.951780378818512,-0.4471886456012726,0.0,0.0
Their bribes—,4.666666666666667,poetry,-0.7795195579528809,0.0,en,-0.8560892343521118,-0.5630701184272766,0.0,0.0
So many silks.,5.333333333333333,poetry,-0.6707843542098999,0.0,en,0.0,-0.4568374454975128,0.0,0.9279000759124756
How they hate you.,2.3333333333333335,poetry,-0.9310698509216307,-0.5719,en,-0.9778335094451904,-0.9252317547798157,0.0,0.0
"They converse in the valley of your fingers, they are inch-worms.",3.6666666666666665,poetry,0.0,0.0,en,0.0,0.0,0.0,0.0
"They would have you sleep in their cabinets,",4.333333333333333,poetry,0.0,0.0,en,0.0,-0.5815414190292358,0.0,0.648561954498291
"This toe and that toe, a relic.",4.666666666666667,poetry,0.7802334427833557,0.0,en,0.9542706608772278,0.0,0.0,0.0
Step off!,4.0,poetry,-0.5757079124450684,0.0,en,-0.8841423392295837,0.5235304832458496,0.0,0.0
"Step off seven leagues, like those distances",5.0,poetry,0.0,0.3612,en,0.0,0.0,0.0,0.0
"That revolve in Crivelli, untouchable.",5.0,poetry,-0.5251349210739136,0.0,en,0.0,-0.3898874819278717,0.0,0.0
"Let this eye be an eagle,",5.333333333333333,poetry,0.4479480385780334,0.0,en,0.7046070694923401,0.4442594349384308,0.0,0.9395791888237
"The shadow of this lip, an abyss.",4.333333333333333,poetry,-0.8158989548683167,0.0,en,-0.9599789381027222,-0.7701045274734497,0.0,0.0
GETTING THERE,5.666666666666667,poetry,0.5078564882278442,0.0,en,0.9328758120536804,-0.8760060667991638,0.0,0.0
How far is it?,4.666666666666667,poetry,0.0,0.0,en,0.0,0.0,0.0,0.0
How far is it?,4.666666666666667,poetry,0.0,0.0,en,0.0,0.0,0.0,0.0
How far is it?,4.666666666666667,poetry,0.0,0.0,en,0.0,0.0,0.0,0.0
How far is it?,4.666666666666667,poetry,0.0,0.0,en,0.0,0.0,0.0,0.0
How far is it?,4.666666666666667,poetry,0.0,0.0,en,0.0,0.0,0.0,0.0
How far is it?,4.666666666666667,poetry,0.0,0.0,en,0.0,0.0,0.0,0.0
How far is it?,4.666666666666667,poetry,0.0,0.0,en,0.0,0.0,0.0,0.0
How far is it?,4.666666666666667,poetry,0.0,0.0,en,0.0,0.0,0.0,0.0
How far is it?,4.666666666666667,poetry,0.0,0.0,en,0.0,0.0,0.0,0.0
How far is it now?,4.666666666666667,poetry,0.0,0.0,en,0.0,0.0,0.0,0.0
The gigantic gorilla interior,4.666666666666667,poetry,-0.5255172252655029,0.0,en,0.7401581406593323,0.7857216596603394,0.0,0.0
"Of the wheels move, they appall me—",4.333333333333333,poetry,-0.5457620024681091,-0.5267,en,-0.6229590177536011,-0.5538649559020996,0.0,0.0
The terrible brains,3.3333333333333335,poetry,-0.949770450592041,-0.4767,en,-0.9775157570838928,-0.9317259192466736,0.0,0.0
"Of Krupp, black muzzles",3.6666666666666665,poetry,0.0,0.0,en,0.0,0.0,0.0,0.0
"Revolving, the sound",5.0,poetry,0.0,0.0,en,0.553503155708313,0.0,0.0,0.0
