text,label,category,tr_xlm_roberta,vader,org_lang,twitter_xlm_roberta_base_sentiment_multilingual,xlm_roberta_base_sentiment_multilingual,memo_bert_sa,da_sentiment_base
"Far out in the sea, the water is as blue as the leaves of the most beautiful grain flower and as clearly as the cleanest glass, but it is very deep, deeper than something anchor rope when many church towers had to be placed on top of each other, to reach from the bottom up over the water.",6.666666666666667,fairytales,0.0,0.5106,dk,0.0,-0.42464882135391235,0.0,0.0
Then the sea people live.,5.0,fairytales,0.0,0.0,dk,-0.5263028144836426,-0.6098880767822266,0.0,0.0
"Now one must not believe that there is only the naked white sandy bottom;No, there are the most marvelous trees and plants that are so supple in stalks and leaves that they are moving at the slightest movement of the water, just as if they were alive.",6.0,fairytales,0.0,0.7836,dk,0.0,0.842734158039093,0.0,0.8974224328994751
"All the fish, small and large, slip between the branches, just like up the birds in the air.",6.333333333333333,fairytales,0.0,0.3612,dk,0.0,0.0,0.0,0.9616048336029053
"In the very deepest place lies the sea king's castle, the walls are of corals and the long pointed windows of the clearest amber, but the roof are seashells that open and close as the water goes;It looks nice;for in each lies brilliant pearls, one would be a large city in a queen of crown.",8.0,fairytales,0.4690128564834595,0.9694,dk,0.7296539545059204,0.7777574062347412,0.9999823570251465,0.6293166875839233
"The king of the sea down there had been a widow for many years, but his old mother held a house for him, she was a wise wife, but proud of her nobility, so she went with twelve oysters on the tail, the other noble had to bear only six.",5.666666666666667,fairytales,0.3821158707141876,0.8519,dk,0.0,0.745126485824585,0.9999226331710815,0.916632354259491
"Otherwise, she deserved a lot of praise, especially because she loved so much of the little sea princesses, her son -in -law.",6.333333333333333,fairytales,0.8614661693572998,0.83,dk,0.9847065806388855,0.8990041613578796,0.9999771118164062,0.9328914284706116
"They were 6 lovely children, but the youngest was the most beautiful of them all, her skin was as clear and cut as a rose blade, her eyes as blue as the deepest lake, but like all the others she had no feet, her body ended up in a fishing tail.",7.333333333333333,fairytales,0.5745205879211426,0.9508,dk,0.9719993472099304,0.9056537747383118,0.9999580383300781,0.9768707752227783
"Throughout the long day they could play down in the castle, in the large halls where living flowers grew out of the walls.",6.666666666666667,fairytales,0.4943698346614837,0.7579,dk,0.49250921607017517,0.5096253156661987,0.0,0.0
"The large amber windows were opened up, and then the fish swam in them, just as with us the swallows fly in as we open, but the fish swam straight to the little princesses, ate their hand and let themselves clap.",7.333333333333333,fairytales,0.0,0.0,dk,0.0,0.0,0.0,0.0
"Outside the castle was a large garden with fiery red and dark blue trees, the fruits beamed like gold, and the flowers like a burning fire in that they always moved stalks and leaves.",6.333333333333333,fairytales,0.463233083486557,0.0516,dk,0.7439883947372437,0.6176446080207825,0.0,0.9418230652809143
"The earth itself was the finest sand, but blue, like Sulfur Lue.",6.0,fairytales,0.0,0.5023,dk,0.0,-0.44904255867004395,0.9997745156288147,0.0
"All over there was a marvelous blue glow, one would rather think that one stood high up in the air and only saw sky above and below you than that one was on the bottom of the sea.",6.0,fairytales,0.5248381495475769,0.5719,dk,0.8856291174888611,0.8781277537345886,0.0,0.0
"In the steady one could eyes the sun, it seemed a purple flower, from whose cup the whole light emerged.",6.666666666666667,fairytales,0.551676332950592,0.0,dk,0.9286251664161682,0.6779245138168335,0.0,0.0
"Each of the little princesses had her little spot in the garden where she could dig and plant as she herself would;One gave his flower -spotted figure of a whale fish, another thought better that her looked like a little mermaid, but the youngest made his quite round like the sun, and had only flowers shining red like it.",5.666666666666667,fairytales,0.4353293180465698,0.8793,dk,0.6016255617141724,0.0,0.9447435140609741,0.9878606200218201
"She was a strange child, quiet and thoughtful, and when the other sisters decorated the most wonderful things they had been given from stranded ships, she would only, besides the rosy flowers that looked like the sun that high up, have a beautiful marble support, a lovely boy it was, carved out of the white, clear stone and by stranding.",6.333333333333333,fairytales,0.0,0.9558,dk,0.6883430480957031,0.876116156578064,0.9999814033508301,0.9852445721626282
"She planted at the support a rosy cry, it grew gloriously, and hung with her fresh branches over it, down towards the blue sandy base where the shade appeared violet and was in motion, just like the branches;It looked as if top and roots were playing to kiss each other.",6.666666666666667,fairytales,0.4689052402973175,0.9274,dk,0.6823664307594299,0.8576602935791016,0.0,0.8410081267356873
"No joy was her greater than hearing about the human world there above;The old grandmother had to tell everything she knew about ships and cities, humans and animals, especially it seemed wonderful that up on the ground smelled the flowers, it did not do so on the bottom of the sea, and that the forests were green and the fish sowing between the branches could sing so loud and lovely, so it was a bright;It was the little birds that the grandmother called fish, otherwise they could not understand her as they had not seen a bird.",7.666666666666667,fairytales,-0.3464540541172027,0.9367,dk,0.47800323367118835,0.857146680355072,0.9641731381416321,0.6234663128852844
"""When you reach your 15 years,"" said the grandmother, ""then you have to be allowed to dive out of the sea, sit in the moonlight on the rocks and see the big ships sailing past, forests and cities to see!""",6.0,fairytales,0.6607615947723389,0.0,dk,0.0,0.7986924648284912,0.0,0.9729061722755432
"In the year that came, one of the sisters was 15 years old, but the other, yes one was a year younger than the other, the youngest of them had even five years before she dared to get up from the bottom of the sea and see what it looked like with us.",5.0,fairytales,0.0,0.5499,dk,0.0,0.0,0.0,0.870398998260498
"But one promised the other to tell what she had seen and found most beautiful on the first day;for their grandmother did not tell them enough, there was so much they had to be told.",6.0,fairytales,0.4100775420665741,0.8717,dk,0.0,0.549279510974884,0.9999748468399048,0.9596379399299622
"No one was as longing as the youngest, just she, who had the longest time to wait and who was so quiet and thoughtful.",4.0,fairytales,0.0,0.144,dk,0.8968319296836853,0.6614461541175842,0.9999325275421143,0.9614207744598389
Many night she stood at the open window and looked up through the dark blue water where the fish struck with their fins and tail.,5.0,fairytales,0.0,0.0,dk,0.0,0.0,0.0,0.5316280126571655
"Moon and stars she could see, though they shone quite pale, but through the water they looked much bigger than for our eyes;Then there was like a black cloud under them, then she knew it was either a whale fish that swam over her, or a ship with many people;They did not think that a lovely little mermaid was standing below and extending his white hands against the keel.",5.333333333333333,fairytales,0.0,-0.6259,dk,0.0,-0.45614635944366455,0.0,0.5906399488449097
Now when the oldest princess was 15 years old and dared to rise above the sea surface.,5.0,fairytales,0.0,0.0,dk,0.0,0.0,0.0,0.0
"When she came back, she had a hundred things to tell, but the most wonderful thing, she said, was to lie in moonlight on a sandbank in the quiet lake, and look close to the coast the big city where the lights flashed, like a hundred stars, hear the music and the noise and noise of wagons and people, see the many church towers and spiers, and hear where the bells rang;Just because she couldn't get up there, she longed for all this.",6.666666666666667,fairytales,0.0,0.9528,dk,0.0,0.9029347896575928,0.0,0.7557849287986755
Oh!,5.666666666666667,fairytales,0.5024263262748718,0.0,dk,0.8413726091384888,0.5622332096099854,0.9564718008041382,0.9810629487037659
"Where did not hear the youngest sister after, and when she stood at the open window at night and looked up through the dark blue water, she thought of the big city with all that noise and noise, and then she seemed to hear the church bells ringing down.",5.333333333333333,fairytales,0.0,0.0,dk,0.0,0.0,0.0,0.7096251845359802
"The following year, the other sister was allowed to rise through the water and swim wherever she wanted.",5.0,fairytales,0.0,0.0,dk,0.8312084674835205,0.0,0.0,0.6682872772216797
"She dived up, just as the sun went down, and that sight she found was the most beautiful.",6.666666666666667,fairytales,0.8560884594917297,0.6361,dk,0.9837694764137268,0.9391800761222839,0.9999691247940063,0.666610598564148
"The whole sky had looked like gold, she said, and the clouds, yes, her essence she couldn't describe enough!",8.0,fairytales,0.6025679707527161,0.6696,dk,0.9474913477897644,0.665175199508667,0.0,0.9974954724311829
"Red and violet they had sailed across her, but far faster than those, flew, like a long white veil, a bunch of wild swans across the water where the sun was standing;She swam towards it, but it sank and the rose -duty switched off on the sea surface and the clouds.",7.0,fairytales,0.0,0.5023,dk,0.0,-0.5637582540512085,0.0,0.0
"The following year, the third sister came up there, she was the boldest of them all, so she swam up a wide river that ran out into the sea.",5.0,fairytales,0.0,0.3818,dk,0.0,0.5961717963218689,0.0,0.8201955556869507
"Lovely green highs with vines she saw, castles and farms looked between magnificent forests;She heard where all the birds sang and the sun shone so warm that she often had to dive underwater to cool her burning face.",8.0,fairytales,0.6302667856216431,0.875,dk,0.9664945006370544,0.9099236726760864,0.9999686479568481,0.9899229407310486
"In a small bay she met a whole bunch of little human children;Quite naked they ran and splashed in the water, she wanted to play with them, but they ran frightened their way, and there was a small black animal, it was a dog, but she had never seen a dog, it barked so terribly of her that she became anxious and searched out in the open lake, but never could forget the beautiful forests, the green talls and the beautiful children who could swim on the water, though they had no fishing hall.",5.333333333333333,fairytales,0.0,-0.9336,dk,0.0,-0.6671826839447021,0.9994506239891052,0.8110330104827881
"The fourth sister was not so bold, she was in the middle of the wild sea, and told that it was just the most beautiful;One saw many miles around it, and the sky above stood like a big glass bell.",7.0,fairytales,0.4543916583061218,0.8419,dk,0.8709832429885864,0.9090245962142944,0.9999746084213257,0.7151885628700256
"She had seen ships, but far away, they looked like beach gulls, the funny dolphins had beaten bucket, and the large whale fish had sprayed water out of their nostrils, so it had looked like a hundred water jumps around.",7.333333333333333,fairytales,0.0,0.9517,dk,0.0,-0.8165884613990784,0.0,0.9888218641281128
Now came the trip to the fifth sister;Her birthday was just in the winter and therefore she saw what the others hadn't seen the first time.,5.0,fairytales,0.0,0.0,dk,0.0,0.0,0.0,0.819335401058197
"The lake was quite green out and around swam there big icebergs, each looked like a gem, she said, and was far greater than the church towers the people built.",6.0,fairytales,0.0,0.3612,dk,0.9397501349449158,0.7506921291351318,0.9861305356025696,0.7983441352844238
In the marvelous figures they showed up and glittered as diamonds.,7.0,fairytales,0.8653213977813721,0.7574,dk,0.9794119000434875,0.918156087398529,0.0,0.0
"She had sat down on one of the biggest and all sailors crossed frightened by where she sat and let the wind fly with her long hair;But in the evening the sky was coated with clouds, the lightning and thundered, while the black lake lifted the large ice blocks high up and let them shine by the red lightning.",5.666666666666667,fairytales,0.4154347479343414,0.5423,dk,0.0,-0.4524131119251251,0.0,0.0
"On all ships, the sails were taken in, there was an anxiety and horror, but she sat calm on her swimming iceberg and saw the blue lightning beam beat in the zigzag into the shining lake.",4.666666666666667,fairytales,-0.461906373500824,0.0644,dk,0.0,-0.4607087969779968,0.0,0.5497483611106873
"The first time one of the sisters came across the water, everyone was always delighted with the new and beautiful she saw, but when they were now, as adult girls, they were allowed to rise up when they wanted, it did not matter, they longed for the home, and after a month they said that down with them was the most beautiful, and there was so nice at home.",6.333333333333333,fairytales,0.4876366257667541,0.9409,dk,0.7375665903091431,0.8827317953109741,0.9999765157699585,0.7377854585647583
"Many evening hours, the five sisters took each other in their arms and rose in a row above the water;Lovely voices they had, more beautiful than any human, and when it pulled up to a storm so they could think that ships had to leave, they swam in front of the ships and sang so nice about how beautiful it was on the sea, and asked the sailors, not be afraid to get there;But these couldn't understand the words, they thought it was the storm, nor did they get the tightness down there, for when the ship sank, the people drowned, and came only as died to the Castle of the Sea King.",3.666666666666667,fairytales,-0.39926877617836,0.3321,dk,0.0,-0.4602598547935486,0.9999706745147705,0.0
"Thus, when the sisters in the evening, arm in the arm, rose high through the sea, then the little sister stood alone alone and looked after them, and it was as if she was crying, but the mermaid has no tears, and then she suffers much more.",2.666666666666667,fairytales,-0.4137137532234192,-0.9056,dk,0.0,-0.8838306069374084,0.9999679327011108,0.0
"""Alas, I was 15 years old though!""",3.333333333333333,fairytales,0.0,0.0,dk,0.0,0.0,0.0,0.8786005973815918
"She said, ""I know I will be right to love the world that above and the people who build and live up there!""",5.0,fairytales,0.769383430480957,0.4199,dk,0.9812766313552856,0.8899426460266113,0.6023870706558228,0.9850127696990967
"Finally, she was then the 15 years.",5.333333333333333,fairytales,0.5344073176383972,0.0,dk,0.0,0.0,0.0,0.0
"""Look now we've got you out of hand,"" said her grandmother, the old widowed queen.",5.0,fairytales,-0.6327204704284668,0.0,dk,-0.9263706803321838,0.46705007553100586,0.0,0.9735413789749146
"""Come on, let me decorate you, like your other sisters!""",5.333333333333333,fairytales,0.4272285103797912,0.4199,dk,0.7288094758987427,0.7372488975524902,0.0,0.9953504800796509
"And she put her a wreath of white lilies on her hair, but every leaf in the flower was half of a gem;And the old one had 8 large oysters squeezed by the princess's tail, to show her high stand.",6.0,fairytales,0.0,0.0,dk,0.5240201354026794,0.5109121203422546,0.0,0.0
"""It hurts so much!""",2.666666666666667,fairytales,-0.9048194289207458,-0.5255,dk,-0.9757285714149475,-0.9457442760467529,0.9966082572937012,0.5396195650100708
said the little mermaid.,5.0,fairytales,0.0,0.0,dk,0.0,0.0,0.0,0.0
"""Yes you have to like something for the city!""",4.666666666666667,fairytales,-0.7627090215682983,-0.5848,dk,0.7855870723724365,0.0,0.0,0.9959768652915955
said the old one.,5.0,fairytales,0.0,0.0,dk,-0.5139268040657043,0.0,0.0,0.0
"She would have liked to shake all this splendor and put the heavy wreath;Her red flowers in the garden dressed her much better, but she didn't dare to do it now.",4.0,fairytales,0.3938558399677276,0.7612,dk,0.5368648171424866,-0.798831582069397,-0.9762313961982727,0.9730488061904907
"""Goodbye"" she said, rising as easily and clearly as a bubble up through the water.",5.666666666666667,fairytales,0.4852085709571838,0.6249,dk,0.7443303465843201,-0.7510673403739929,0.0,0.9902814626693726
"The sun had just gone down as she lifted her head up over the sea, but all the clouds were still shining like roses and gold, and in the middle of the pale red air beamed the evening star so clearly and lovely, the air was mild and fresh and the ocean quiet.",7.0,fairytales,0.4738562405109405,0.9541,dk,0.8186662793159485,0.8962991237640381,0.9999799728393555,0.5861974358558655
"There was a large ship with three masts, a single sail was only up, for not a wind moved and around the rope and on the bars sat sailors.",5.333333333333333,fairytales,0.0,0.0,dk,0.0,0.0,0.0,0.7743215560913086
"There was music and singing, and everything like the evening was darker, a hundred variegated flashlights were lit;They looked as if the flags of all nations were waving in the air.",5.666666666666667,fairytales,0.4915767014026642,0.0,dk,0.8432571291923523,0.0,0.0,0.868273913860321
"The Little Mermaid swam straight to the cabin window, and every time the water lifted her up, she could look in of the mirror -clear windows where so many decorated people stood, but the most beautiful was the young prince with the big black eyes, he was not much over 16 years old, it was his birthday, and so all this city happened.",6.333333333333333,fairytales,0.0,0.8363,dk,0.0,0.8351132869720459,0.9999485015869141,0.898591160774231
"The sailors danced on the deck, and as the young prince stepped out, over a hundred rockets rose up into the air, they shone like the clear day, so the little mermaid was quite frightened and appeared under the water, but she soon stuck her head back up, and then it was like all the stars of the sky fell to her.",6.666666666666667,fairytales,0.0,0.7582,dk,0.0,-0.6245576739311218,0.9993271827697754,0.0
Never had she seen such fire.,6.666666666666667,fairytales,0.8413501977920532,-0.34,dk,0.6317532658576965,-0.5732390284538269,0.0,0.0
"Big sole spun around, magnificent firefish swung in the blue air, and everything shone back from the clear, quiet lake.",7.0,fairytales,0.699953019618988,0.891,dk,0.9013745784759521,0.9061184525489807,0.0,0.0
"On the ship itself was so bright that you could see every little rope, the people.",5.0,fairytales,0.5236594676971436,0.5777,dk,0.8162022233009338,0.719331681728363,-0.9998704195022583,0.8089545369148254
"Oh where the young prince was beautiful, and he pressed the people in his hand, laughed and smiled while the music sounded in the lovely night.",7.666666666666667,fairytales,0.8545626997947693,0.9201,dk,0.9729902148246765,0.9081591367721558,0.9999821186065674,0.9951476454734802
"It became herring, but the little mermaid could not turn his eyes away from the ship and from the lovely prince.",6.666666666666667,fairytales,0.0,0.7351,dk,0.9230796098709106,0.5407752394676208,0.0,0.9054613709449768
"The variegated lamps were turned off, the rockets no longer rose, nor did none more cannon shots, but deep down the sea buzzing and humming what she was sitting in the water and rocking up and down so that she could look into the cabin;But the ship took stronger speed, one sail spread out after another, now the waves went stronger, big clouds pulled up, it was lightning far away.",3.666666666666667,fairytales,0.0,0.9052,dk,0.0,0.0,0.0,0.0
"Oh, that would be a terrible weather!",2.666666666666667,fairytales,-0.9360295534133912,-0.5255,dk,-0.9742870926856995,-0.9218854308128357,0.0,0.9869911074638367
"Therefore, the sailors took the sails in.",5.0,fairytales,0.0,0.0,dk,0.0,0.0,0.0,0.0
"The large ship rocked in flying speed on the wild lake, the water rose, just like large black mountains that would overturn over the mast, but the ship dive, like a swan, down between the high waves and again lifted up the towering waters.",3.666666666666667,fairytales,0.4305995404720306,0.8442,dk,0.0,0.4562523365020752,0.0,0.8891245126724243
"It seemed the little mermaid just was a funny speed, but the sailors did not seem, the ship was cracking and cracking, the thick planks abounded by the strong shocks the lake made against the ship, the mast cracked in the middle, just as it was a tube, and the ship was wandering on the side as the water penetrated into the room.",3.333333333333333,fairytales,-0.470750480890274,0.3716,dk,0.0,-0.8005512952804565,0.0,0.0
"Now the Little Mermaid saw that they were in danger, she had to pay attention to beams and bits of the ship drifting on the water.",3.333333333333333,fairytales,-0.6751976609230042,-0.5267,dk,0.0,-0.828001081943512,0.0,0.0
"One moment it was so bolding dark that she couldn't see the least, but when it was lightening, it became so clear again that she knew them all on the ship;Each tumbled the best he could;She was especially looking for the young prince, and she saw him when the ship parted, sinking into the deep lake.",2.333333333333333,fairytales,0.0,0.9072,dk,0.0,0.0,0.9983953833580017,0.831366777420044
"Immediately she was quite happy, because now he came down to her, but then she remembered that humans cannot live in the water and that he could not, without death, come down to her father's castle.",2.666666666666667,fairytales,0.0,-0.3847,dk,0.8397787809371948,-0.5546234846115112,0.9999637603759766,0.775091826915741
"No die, he didn't have to;Therefore, she swam between beams and planks drifting on the lake, forgot clean that they could have crushed her, she dives deeply underwater and rose again high between the waves, and eventually came to the young prince, who could hardly swim anymore in the storming lake, his arms and legs began to become matte, the beautiful eyes closed,",3.666666666666667,fairytales,-0.4793371856212616,-0.9104,dk,0.0,-0.6389490365982056,0.9999567270278931,0.9740522503852844
"She held his head up over the water, and then let the waves drive her with him wherever they wanted.",5.0,fairytales,0.0,0.0,dk,0.7287994027137756,0.0,0.0,0.9812410473823547
"In the morning, the evil weather was over;Of the ship was not a shavk to see, the sun rose so red and shiny from the water, it was as if the prince's cheeks got life thereby, but the eyes remained closed;The mermaid kissed his tall beautiful brow and stroked his wet hair back;She thought he looked like the marble support down in her little garden, she kissed him again, and wanted him to live.",6.333333333333333,fairytales,0.0,0.8945,dk,0.0,0.512686550617218,0.9999428987503052,0.9009420275688171
"Now she saw in front of her the solid land, tall blue mountains, on whose top the white snow shone, which was the swans that lay;Down by the coast were lovely green forests, and in front was a church or a monastery, she didn't know it right, but a building was.",5.666666666666667,fairytales,0.0,0.4019,dk,0.0,0.5144647359848022,0.9916346073150635,0.0
"Lemon and orange trees grew in the garden, and in front of the gate stood tall palm trees.",5.0,fairytales,0.0,0.0,dk,0.5156764388084412,0.4965633153915405,0.0,0.0
"The lake here made a small bay that was quiet but very deep, right to the rock where the white fine sand was flushed up, here she swam with the beautiful prince, put him in the sand, but especially made sure that the head was high in the warm sunshine.",6.333333333333333,fairytales,0.4699345529079437,0.9478,dk,0.8410292267799377,0.6784780621528625,0.8079072833061218,0.8793973922729492
Now the bells rang in the large white building and many young girls came through the garden.,5.0,fairytales,0.0,0.0,dk,0.6937434077262878,0.0,0.0,0.0
"As the Little Mermaid swam further out behind some tall stones, which rose out of the water, laid siblings on her hair and her chest so that no one could see her little face, and then she looked after who came to the poor prince.",4.666666666666667,fairytales,0.0,-0.6786,dk,0.0,0.0,0.0,0.9851847887039185
"It wasn't long before a young girl got there, she seemed to be quite frightened, but only for a moment, then she picked up more people, and the mermaid saw that the prince got life and that he smiled at all of them around, but out to her he did not smiled, he did not know that she had saved him, she felt so sad, and when he was led into the big building, she divered into the water and diving into the water and diving into the water, and in the water, she was sorting into the great building.searched home to his father's castle.",3.333333333333333,fairytales,-0.3982267677783966,0.0648,dk,0.0,-0.8228092789649963,0.9999712705612183,0.0
"She had always been quiet and thoughtful, but now she became much more.",3.666666666666667,fairytales,0.0,0.2023,dk,0.8259482383728027,0.5429097414016724,0.999981164932251,0.9934422969818115
"The sisters asked her what she had seen it the first time up there, but she didn't tell anything.",4.666666666666667,fairytales,0.0,0.0,dk,0.0,0.0,0.0,0.8426684141159058
Many evening and morning she got up where she had left the prince.,4.666666666666667,fairytales,0.0,0.0,dk,0.0,0.0,0.0,0.7723870873451233
"She saw where the fruits of the garden mature and were picked, she saw where the snow melted on the high mountains, but the prince she did not see, and so she always returned even more sadly.",3.0,fairytales,-0.435315728187561,-0.6946,dk,0.0,-0.9141750931739807,0.0,0.9819038510322571
